发现 羊羊子 爱 上 景德镇 看 一次 惊艳 一次 作品 都 会 说话 都 风格 魅力 热爱 可抵 岁月 漫长 太对 爱 吃 爱 生活 每次 看到 羊羊子 发 美食 耶 都 感觉 很 治愈 很 美好 哎呀呀 云逛 乐天 集市 以后 去 景德镇 看一看 一定 买买 买 满载而归 ,0,1,0,0
终于 时间 来补 视频 器物 之美 生活 之美 热爱 无惧 ,0,1,0,0
太 美好 ,0,1,0,0
花 花盘 太 好看 好   已经 想象 哈哈哈哈 ,0,1,0,0
感觉 去 景德镇 钱包 要空 肯定 不停 买买 买 价格 贵,-1,0,0,0
蘑菇 头 好 可爱 ,0,1,0,0
画 盘子 杯子 都 好好看 ,0,1,0,0
宝贝 精致 喜欢 好看 买 件 ,0,1,1,0
买 几件 景德镇 陶瓷 回家 摆件 好看,0,1,0,0
美得 嘞 ,0,1,0,0
真 不 戳 好看,0,1,0,0
好美 ,0,1,0,0
周末 陶溪川 每个 摊子 作品 都 好好看 ,0,1,0,0
最后 一张 图里 耳饰 都 很 好看 ,0,1,0,0
共赴 景德镇 逛 陶然 集 漂亮 ,0,1,0,0
好 漂亮 ,0,1,0,0
共赴 景德镇 逛 陶然 集 想要 想要 想要 绝美,0,1,0,0
江西 景德镇 陶瓷 质量 杠杠 滴 ,0,0,1,0
漂亮 ,0,1,0,0
想 去 景德镇 看 陶瓷 好美,0,1,0,0
庶几 说怿   天呐 瓷器 真的 好 漂亮 ,0,1,0,0
瓷器 之美 ,0,1,0,0
太太 太太 太 太太 太太 好看 ,0,1,0,0
爱 真的 好好看 ,0,0,0,0
感觉 质量 不错,0,0,1,0
大脸 姑娘 儿 共赴 景德镇 逛 陶然 集   好 想 去   好 想 感受 瓷都   不是 好看 形容   精致 作品 ,0,1,1,0
共赴 景德镇 逛 陶然 集   好 想 去   好 想 感受 瓷都   不是 好看 形容   精致 作品 ,0,1,1,0
陶溪川 真是 手工艺者 展示 产品 好 地方 共赴 景德镇 逛 陶然 集 ,0,0,1,0
棒 好看,0,1,0,0
真的 好好看 瓷器 ,0,1,0,0
好看 想要 ,0,1,0,0
好好看 好 想 去 ,0,1,0,0
当然 可爱 爱 创意 成品 ,0,1,0,0
最 喜欢 瓷器 漆器 动手做 更好 精致,0,0,1,0
当然 集市 里 陶瓷 工艺品 精致,0,0,1,0
展览 手工艺品 精致 最爱 应该 各种各样 杯子 ,0,1,1,0
手工艺品 做工 精湛,0,0,1,0
当然 各式各样 手工艺品 精致,0,0,1,0
太美 艺术瓷 都 景德镇 ,0,1,0,0
当然 里面 小商品 感兴趣 可爱,0,1,0,0
陶瓷 小玩意 好可爱,0,1,0,0
期待 精美 品 ,0,1,0,0
比较 喜欢 陶瓷 外观 新奇,0,1,0,0
真滴 很 喜欢 青花瓷 那种 磨砂 质感 杯子 灯 上 透光 杯子 具体 不 清楚 ,0,1,1,0
共赴 景德镇 逛 陶然 集   各种各样 小 陶瓷 工艺品 有趣 ,0,1,0,0
共赴 景德镇 逛 陶然 集   最 感兴趣 陶瓷 手工艺品 绝美 精致 ,0,1,1,0
买 不起,-1,0,0,0
东西 漂亮 ,0,1,0,0
全部都是 道光 独有 纹样 ,0,1,0,0
太 好看 ,0,1,0,0
好 喜欢 这种 款式 好看 ,0,1,0,0
p8 色调 太 舒服 太漂亮 5555 ,0,1,0,0
可能 会 狠狠 纠结 带 杯 碗 回家 不愧 景德镇 都 喜欢 好美,0,1,0,0
瓷器 都 好 美 最 喜欢 p8 碗 ,0,1,0,0
诺 男朋友 穿 很 素雅 瓷器 ,0,1,0,0
p3 盘子 发光 啊啊啊 ,0,1,0,0
好看 喜欢 ,0,1,0,0
六月 十五   好 想 去 景德镇 瓷器 都 想 搬 回家 太贵 买不起,-1,0,0,0
巧夺天工 ,0,0,1,0
这是 天赐 珍宝 ,1,0,0,0
不得不 说 颜色 造型 想象力 都 很 绝 喜欢 ,0,1,0,0
这太 好看 ,0,1,0,0
工艺 震撼   绝 ,0,0,1,0
真 漂亮 ,0,1,0,0
青花 满工 工艺 精湛,0,1,1,0
文化 瑰宝 魅力 ,1,0,0,0
景德镇 陶瓷 太美 机会 想 去 当地 看看 ,0,1,0,0
景德镇 瓷器 非常 具有 观赏价值 机会 不要 错过 ,0,1,0,0
似 无 完整 传世 品 ,1,0,0,0
竟然 … … 长 知识   之前 写 小说 还 特意 拍 洪武 釉里红 做 参考 … 南京博物院 展览 釉里红 大盘 好像 压根 没 提过 茬 ,0,1,0,0
酱 色釉 好好看 ,0,1,0,0
堪称 青花 之王 ,0,1,0,0
好 漂亮 颜色 纹饰 ,0,1,0,0
景德镇 明清 古 瓷器 龙 几个 都 非常 精致 繁复 乾隆 时期 富丽堂皇 之相 此物 景德镇 中国 陶瓷 博物馆 景德镇 御 窑厂 遗址 博物馆 收藏 ,0,1,1,0
瓷器   一组 咸丰 官窑 瓷器 咸丰 年间 内忧外患 御 窑厂 烧 瓷器 官样文章 交差了事 做 人 无趣 看 人 无聊 仿 嘉靖 鹤 纹 竟然 呆若木鸡 琢器 比例失调 许之衡 饮流 斋 说 瓷 里 论调 精准 皇朝 精气神 变迁 全体 现在 瓷器 里 ,0,-1,-1,0
瓷器   两只 永乐 青花 大碗 图一 宫里 传世 品 透明 釉有 开片 口沿 变形 图二 景德镇 御 窑厂 出土 釉面 开片 黄色 应该 土沁 器型 规整 无 变形 严格来说 两件 都 残次品 苏麻离 青发色 好 只入 宫 发色 灰暗 只 处理 从明 初 对型 质 审美 就让 位于 纹饰 ,0,1,1,0
首博 典藏   粉 青釉 描金 镂空 开光 粉彩 荷莲 童子 转心 瓶 清乾隆   1736 1795 高 28.1 厘米 此器 清乾隆 时期 景德镇 御 窑厂 烧制 外壁 施粉 青釉 描金 西番莲 纹饰 瓶颈 饰 四喜 童子 腹部 开光 镂空 内心 饰 粉彩 采莲图 圈足饰 莲瓣 纹 造型 奇巧 显示 出 乾隆 时期 景德镇 官窑 瓷器 艺术 无穷 魅力 首都博物馆 藏 全文 ,0,1,1,0
瓷器 清乾隆 瓷 搬 指 台北 故宫博物院 藏 中瓷 4358 中瓷 4375 各式 搬 指同 储于 木匣 中 乾隆 官窑 烧造 各类 釉彩 形制 各式 纹样 造办 处 中 皆 档案 追查 特别 釉彩 一项 历年 往返 文书 中 透露 出御 窑厂 生产 前朝 风格 相似 不同 作品 加上 雍正 六年 乾隆 二十一年 以前 御 窑厂 实际 负   全文 ,0,1,0,0
南宋 官窑 中国 礼乐 文化 　 　 座落在 杭州 城南 乌龟 山西 麓 南宋 官窑 目前 发现 最早 专门 烧制 南宋 宫廷 用瓷 御 窑厂 产品 造型 古朴 典雅 色泽 纯净 滋润 如玉 最能 表现 特点 大量 仿 青铜器 造型 礼器 簋 式 炉 樽 式 炉 鼎式 炉 觚 贯耳 瓶 八棱瓶 鬲式 炉 仿古 礼器 大量 出现   全文 ,0,1,0,0
法国 匠人 手工 上釉 描金 过程   塞 弗尔 窑 法式 中国 风 塞 弗尔 窑 18 世纪 时 法国 专门 用来 生产 皇室 瓷器 御 窑厂 所产 瓷器 常用 金粉 描边 奢侈 黄金 涂层 繁复 鎏金 技术 精致 优雅 釉面 装饰 闻名 瓷器 风格 杂糅 当时 盛行 洛可可 艺术 中国 风 YTB S è vres Manufacture   et   Mus e   nationaux 全文 ,0,1,1,0
晚安 今日 大家 带来 清光绪 红彩 轧 道 海水 青花 八仙 人物 碗 碗 心绘 寿星 鹿 踏浪 祥云 翱翔 碗 外壁 青花 绘 八仙过海 故事 人物 线条 流畅 青花 发色翠艳 衣带 当风 底纹 以红料 彩绘 满绘 海水 波涛 纹 汹涌澎湃 线条 流畅 此类 碗 官窑 传统 产品 始于 乾隆 后朝御 窑厂 多有 沿袭 烧造 乾隆 后 通常   全文 ,0,1,0,0
古瓷 鉴定 唐窑 黄地 青花 缠枝 花纹 转心 瓶 清代 乾隆 元年 十四年 1736 1749 十七年 二十一年 1752 1756 九江 关 监督 唐英 监督 江西 景德镇 御 窑厂 督造 瓷器 代称 其器 仿古 釉色 悉能 巧合 创制 洋紫 冻青 银洋 彩 水墨 鸟金 珐琅 洋彩 黑地 五彩 蓝花 黑花 描金 窑变   全文 ,0,1,0,0
收藏 瓷器 景德镇 陶瓷 史上 明代 出现 官搭民烧 指御 窑厂 无法 按时 完成 皇家 烧制 任务 一部分 瓷器 御 窑厂 内 成型 后 搭 民窑 内 烧制 晚清 清政府 国力 衰退 无暇顾及 瓷业 搭民烧 2016 年 景德镇 重新 掀起 柴 烧热 景德镇 众多 制瓷 人 老祖宗 传统 无比 向往 却 无奈 不能 尽数 搭建   全文 ,0,1,0,0
苏富比 香港 趣雅 东方 明宣德 雪花 蓝釉 香炉 大明 宣德 年制 款 21   公分 8   1 4   英寸 估价   800 000 1 200 000   港币 雪花 蓝 低温 钴蓝釉 明代 御 窑厂 新创 釉色 烧成 难度 极高 实属 罕见 完整 雪花 蓝釉器 本品 外 存世 仅 八件 七器 属 厚壁 大碗 余下 一碗 器壁 外 撇 形制 较为 常见 却 无款   全文 ,1,1,1,0
️ 甜白 釉 明永乐 时期 景德镇 御 窑厂 创烧 白釉 品种 特点 白如 凝脂 素 犹 积雪 明代 黄一正 所撰 事物 绀珠 载 永乐 宣德 二窑 内府 烧造 以鬃 眼甜 白为 常 甜白 称谓 沿用至今 称 甜 釉色 恬静 柔润 人 甜美 之感 ️ 甜白 釉器 明代 永乐 窑 生产 最为 著名 以薄   全文 ,0,1,1,0
美人醉 绿如 春水 初 生日 红似 朝霞 欲 上 时 美人醉 又称 豇豆 红 海棠 红 清代 康熙 年间 御 窑厂 烧制 铜 红 釉 色调 淡雅 犹如 桃花 酷似 豇豆 约色 带有 绿色 苔点 早些 年用 老矿 釉料 烧 美人醉 今天 有缘人 带走 如今 矿料 再 好 技术 烧 不出 这种 釉色   大连 国际 新城 ,1,1,1,0
受 欧洲 赭墨 珐琅 彩瓷 影响 而生 墨彩 纹饰 首 见于 雍正 一朝 时 初见 以瓷 仿拟 不同 材质 器物 1732 年 江西 通志 记载 雍正年间 年希尧 唐英 担任 景德镇 御 窑厂 督陶 官下 烧造 各式 器形 号 四十 墨 彩瓷 此新 技术 画师 得以 于瓷 上 浓淡 墨色 笔法 皴染 绘作 传统 山水画 描写 人物 花鸟 植栽 细节   全文 ,0,1,0,0
鸣鹿行 述异记 载 鹿 千年 苍鹿 五百年 白鹿 五百年 化为 玄鹿 中国 文化 中 鹿是 长寿 尊贵 象征 受到 历代帝王 青睐 无论是 明万历 青花 五彩 百鹿尊 清 乾隆年间 景德镇 御 窑厂 出品 粉彩 百鹿图 螭 耳尊 都 帝王 铭德之器 鸣鹿行 卷 正是 粉彩 百鹿 图为 灵感 蓝本   全文 ,0,1,0,0
发表 博文 豇豆 红 瓷器 豇豆 红 瓷器 康熙 晚期 景德镇 御 窑厂 创烧 高温 红釉 品种 因釉 颜色 似 豇 jing 豆 颜色 得名 金属 铜为 着色剂 烧制 过程 中因 部分 氧化 产生 绿色 斑点 与器 身红釉 相映成趣 豇豆 红 豇豆 红 瓷器 ,0,1,1,0
发表 博文 宝月 瓶 宝月 瓶 亦 称 抱 月 瓶 古代 游牧民族 使用 贮水 贮酒 工具 因其瓶 腹 形似 圆月 得名 这种 器物 中国 存在 西亚 北方地区 十分 流行 图为 乾隆 御 窑厂 生产 黄釉 暗刻 西番莲 纹宝 月 瓶 台北 故宝 月 瓶 ,0,1,0,0
故宫博物院   國立 故宫博物院   国家博物馆   上海博物馆   人民日报   清乾隆   珐琅 彩   花鸟 纹碗   珐琅 彩 宫庭 御制 瓷器 景德镇 御 窑厂   精制 白瓷   运 进宫 后   由造 办处 出 画稿 宫庭 画师 画 瓷器 入 宫内 小窑 直接 低温 700 800 度 烧制 而成 珐琅 料 进口   价格 极贵 康   雍   乾 只 烧成 3700 只 左右 都   全文 ,1,1,0,0
实践证明 研究 瓷器 比烧 瓷器 容易 14 半成品 烧成 3 成品率 还 没有 清代 御 窑厂 高   北京 故宫博物院 ,0,0,0,0
神奇 文物   窑变 釉 流淌 色彩 时代 最 摄人心魄 美 景德镇 御 窑厂 掌门人 唐英 密不可分 景德镇 御 窑厂 皇家 烧制 瓷器 机构 皇帝 喜欢 式样 唐英 必须 拿出 相应 产品 唐英 团队 仿 钧窑 瓷器 基础 上 创新 出 窑变 釉瓷 器 红色 底 釉 上 覆盖 易 分离 流淌   全文 ,0,1,1,0
故宫 藏 康熙 高 24 2 厘米 霁 红 釉 梅瓶 梅瓶 小口 短颈 丰肩 肩 以下 渐 收敛 玉璧 形底 通体 施霁红 釉 玉璧 形底 心内施 白釉 署 青花 楷体 大清 康熙 年制 六字 双 行款 款外 无边 栏 造型 规整 釉面 匀净 标志 明代 中期 以来 失传 高温 铜红 釉瓷 器 康熙 时 景德镇 御 窑厂 得到 恢复 梅瓶 最初 应为 盛酒 之用 其造   全文 ,0,1,0,0
瓷器   清雍正 御制 青花 釉里红 云海 腾龙 大 天球 瓶 欣赏 雍正 一朝 虽仅 13 年 御窑 品质 上佳 特别 雍正 六年 唐英 督理 景德镇 御 窑厂 陶务 以来 制瓷 工艺 不断 推陈出新 所出 御瓷 品质 精绝 引来 后世 赞誉 无数 史 称 唐窑 这件 清雍正   御制 青花 釉里红 云海 腾龙 大 天球 瓶 唐窑 所出 无 上隽品 其体   全文 ,0,1,1,0
中国 地方 名片 洋 记者 千年 瓷都 探寻 中国 文化 魅力 几乎 所有 古文明 都 发明 陶器 瓷器 却 中国 首创 景德镇 一座 中国 东南 小城 china 词 名扬天下 青花 玲珑 粉彩 颜色 釉 景德镇 瓷器 美 名扬 曾 专门 设立 御 窑厂 严密 保护 先进 制瓷 技艺 陶瓷 制成 器 过手 七十二 景德镇 千百年来 践行   全文 ,0,1,0,0
中国 地方 名片 洋 记者 千年 瓷都 探寻 中国 文化 魅力 几乎 所有 古文明 都 发明 陶器 瓷器 却 中国 首创 景德镇 一座 中国 东南 小城 china 词 名扬天下 青花 玲珑 粉彩 颜色 釉 景德镇 瓷器 美 名扬 曾 专门 设立 御 窑厂 严密 保护 先进 制瓷 技艺 陶瓷 制成 器 过手 七十二 景德镇 千百年   全文 ,0,1,1,0
早晨 滴滴 司机 交谈 得知 当地 瓷器 市场 逛 完 景区 雨 已经 下 很大 原 计划 去 御 窑厂 居然 关闭 12 月份 才 开放 遗憾 决定 吃个 午餐 去 当地 市场 买点 喜欢 瓷器 不得不 吐槽 江西 人民 爱 吃 辣 真是 爱到 骨子里 早餐 都 辣 天下无敌 买 一点 喜欢 茶具 餐具 真是 冻得 鼻涕 眼泪   全文 ,0,0,0,0
人民 谋 幸福 中华 优秀 传统 文化 保护 传承 闯 新路 景德镇 大力 实施 陶瓷 文化 保护 传承 工程 综述 景德镇 千年 瓷都 陶瓷 文化底蕴 深厚 近年来 该市 创新 引领 以御 窑厂 遗址 保护 龙头 大力 实施 陶瓷 文化 保护 传承 工程 中华 优秀 传统 文化 保护 传承 勇闯 新路 　 　 御 窑厂 遗址 保护 规划 新一轮   全文 ,0,0,0,0
景德镇 御 窑厂 明清 官窑 遗址 当年 督陶官 带领 一批 一批 能工巧匠 烧制 一件件 精美绝伦 官窑 瓷器 说 世界 陶瓷 生产 史上 难以逾越 巅峰 历史 上 留下 督陶官 姓名 真正 第一线 生产 瓷器 匠 人们 姓名 倒 不 可知 目前 展示 出土 瓷器 来看 现在 发掘 部   全文 ,0,1,0,0
行走 艺术   清雍正   斗彩 福寿 三多纹 撇口 碗   碗 纹饰 釉下 勾勒 细致 釉上 填彩 精准 色泽 清逸 秀雅 外壁 所绘 折枝 瑞果 粉彩 填色 烧成 后 浓淡 深浅 不 层次分明 生动 逼真 属 宫廷 御制 上乘之作 粉彩 运用 斗彩 装饰 之中 雍正 御 窑厂 一大 突破 内府 作坊 珐琅 彩 基础 上 加入 乳浊剂 玻璃 白   全文 ,0,1,1,0
心情 不好 出去 散散心 了解 文化 买 喜欢 东西 女人 开心起来 很 简单 景德镇   古窑 博物馆 御 窑厂 陶溪川 打卡 图九 工艺 老板 说 成功 几率 很 低 看到 第一眼 超级 喜欢 怕 碰 不到 咬牙 买 之后 逛 店 还 真 没 看到 这种 值 当地 小吃 饺子 粑 粑 咸水 粑 ,0,1,0,0
清乾隆 青花 缠枝 四季 花卉 纹梅瓶 大清 乾隆 年制 篆书 款   此件 梅瓶 乾隆 经典 陈设 御瓷 造型 纹饰 皆 仿 明宣德 青花 乾隆 早期 御 窑厂 烧制 瓷器 为督 陶官 唐英 任职 督理 期间 所烧 瓷器 样式 纹饰 上 接近 雍正 风格 纹饰 绘制 拉 胚 塑造 皆 乾隆 晚期 严谨 规整 无不 精美 唐英   全文 ,0,1,0,0
陶瓷 陶瓷 知识   欣赏 保利 秋 拍 乾隆 粉彩 无量 寿佛 绿度母 白度母 三尊 一组 满清 皇室 笃信 藏传佛教 传统 藏地 金铜 材质 以外 景德镇 御 窑厂 奉旨 烧造 瓷质 造像 法器 工艺 精湛 令人 叹为观止 极 一时 之盛 开 一代 未有 之奇 泥塑 绘画 敷色 烧瓷 集于一身 烧造 当中 极易 变形 疵裂 成品率 极低   全文 ,0,1,1,0
文玩 天下 洪武 二年 御 窑厂 正式 景德镇 设计 这是 中国 历史 上 第一家 真正 意义 上 官窑 朝廷 开设 监督 运营 当时 全国 最好 工匠 汇聚 御窑 厂里 最好 瓷土 宫廷 生产 各式 瓷器 由此 带动 附近 民间 制 瓷业 使 景德镇 迅速 成为 全国 制瓷 中心 形成 工匠 四方 器成 天下 走 繁荣 局   全文 ,0,1,1,0
1 清代 康熙 青花瓷 精美 清代 后朝 大量 仿制 仿制 康熙 青花 作品 最多 光绪 2 清代 康熙 青花瓷 器 久负盛名 分为 早 中 晚 三个 时期 御 窑厂 康熙 早期 生产 大量 无 款识 青花瓷 3 中国 鼻烟壶 精美 工艺品 采用 瓷 铜 象牙 多种 材质 制成 玉石 玛瑙 琥珀 属于 制作 鼻烟壶 原料   全文 ,0,1,1,0
人民 谋 幸福   景德镇 明代 葫芦 窑复 烧 点火 19 日 上午 江西省 景德镇 举办 督陶官 唐英 纪念馆 开馆 暨 景德镇 明代 葫芦 窑复 烧 点火 仪式 唐英 清代 陶瓷 艺术家 景德镇 御 窑厂 管理 陶务 12 余年 潜心 钻研 陶务 主持 烧制 瓷器 无不 精美 古窑 景德镇 千年 制瓷 缩影 复烧 明代 葫芦 窑正 象征 景德镇 千年 不 熄   全文 ,0,1,1,0
悦色集 清乾隆   粉彩 皮球 花 纹罐 一对 大清 乾隆 年 製 款此 皮球 花纹 罐 图案 抽象 属 景德镇 御 窑厂 最为 大胆 创新 之作 纹饰 上 变革 归功于 勇敢 创新 雍正帝 勇于 超越 传统 力求 突破 推陈出新 其父 康熙帝 复兴 御窑 鼓励 烧瓷 技艺 发展 四子 雍正帝 御瓷 之器 形 纹饰 注入 新 生命 此举   全文 ,0,1,1,0
永乐 三宝 甜白 釉瓷 器为 常 青花瓷 器为 贵 鲜红 釉瓷 器为 宝 明 初 景德镇 设立 御 窑厂 专门 烧制 宫廷 御用 瓷器 这时候 瓷器 无论是 工艺 器具 种类 都 达到 陶瓷 史上 高峰 ,0,1,1,0
紫禁城 清宫 档案 记载 中 景德镇 御 窑厂 承烧 瓷器 常见 大运 瓷器 传办 瓷器 大运 瓷器 指御 窑厂 往年 定例 不用 皇帝 下旨 烧造 瓷器 相当于 御 窑厂 每年 基本 任务 类 瓷器 器型 纹样 固定 数量 统一 运 京城 交付 清宫 瓷库 收贮 每年 年底 清宫 内务府 奏销 传办 瓷   全文 ,0,1,0,0
聚焦 瓷都   垃圾 有时 放错 地方 宝贝 景德镇 御 窑厂 元 明 清 三代 专 宫廷 烧造 供奉 瓷器 皇家 瓷厂 我国 烧造 时间 最长 规模 最大 工艺 极为 精湛 官办 窑厂 长达近 700 年 时间 里 天下 窑器 之所聚 御窑 烧制 出来 产品 均 皇家 使用 十分 严格 拣选 制度 绝 大多   全文 ,0,1,1,0
每日 一品 清代 乾隆   青花 缠枝莲 蒜头 瓶 丰宝斋 艺术馆 藏品 蒜头 瓶 明清两代 景德镇 窑御 窑厂 烧制 较为 常见 官窑 器 多为 陈列 器 源自 上 三代 青铜 蒜头 壶 瓶口 似 蒜头 得名 藏品 蒜头 圆口 束颈 溜 肩 鼓腹 圈足 青花 发色 浓郁 以缠 枝莲纹 主题 通体 共有 七层 青花 纹饰 口 沿部 两条   全文 ,0,1,1,0
故宫 早安 故宫 起来 读 故宫 日历   清光绪 藕荷 粉彩 球 梅花 鸟图 渣 斗 宫廷 下发 画样 时 不是 一种 器形 都 附带 小样 景德镇 御 窑厂 工匠 瓷器 造型 不同 特点 设计 图案 位置 如碗 高足 碗 渣斗 盒子 内壁 多为 光素 外壁 表现 主题 图案 盘 高足 盘 碟 高足 碟 匙   全文 ,0,1,0,0
总有 惊喜 总有 微风 … … 御 窑厂 遗址 整修 关闭 旁边 小巷 进去 看看 曾经 烧制 无数 精品 皇家 瓷厂 喜欢 沿途 旧街 窄巷 市井 风情   景德镇 御 窑厂 遗址 ,0,1,1,0
天球 瓶受 西亚 文化 影响 出现 一种 瓷器 造型 创烧 明代 永乐 时 景德镇 窑 流行 宣德 时期 海水 龙纹 为贵 天球 瓶 圆球 腹 硕大 天 降下来 得名 清代 雍乾时 推崇 永宣 青花 器 仿制 永宣 天球 瓶 成为 清代 官窑 瓷中 尊品 乾隆 三年 御 窑厂 奉旨 烧制 一大批 摹古 瓷器 宣窑 放大 天球 瓶 一件 ,0,1,0,0
百花 不 露地 清代 社会 文化 达到 顶峰 时 产物 清乾隆 时期 景德镇 御 窑厂 汇集 当代 最 著名 一批 名工 巧匠 令 时期 瓷器 不论是 数量 质量 上 都 达到 不可企及 高度 百花 不 露地 时期 产生 ,0,1,1,0
民谚 有云 想 穷 烧 红 实际上 自永宣创 祭红 之后 官窑 几成 绝响 直至 清康熙 时 方始 重烧 民间 极少数 顶尖 高手 能够 烧造 御 窑厂 每次 烧红 亦 大大 挑战 祭红 烧制 更 令人 觉得 不可思议 ,0,0,1,0
本周 CC 君去 景德镇 御 窑厂 七十二 道 制瓷 工序 精美绝伦 皇家 瓷器 遗址 互为 呼应 保护 建筑 匠心独运 微缩 模型 绿树成荫 下 龙珠阁 字 美 ,0,1,1,0
真的 很棒 美人醉 又称 豇豆 红 海棠 红 清代 康熙 年间 御 窑厂 烧制 铜 红 釉 色调 淡雅 犹如 桃花 酷似 豇豆 约色 带有 绿色 苔点 后人 描述 绿如 春水 初 生日 红似 朝霞 欲 上 时 釉色 上乘 名 大红袍 正红 遍体 一色 明快 鲜艳 洁净 无瑕 略次者 釉色 豇   全文 ,0,1,1,0
王阳明 心 学 引发 思想 潮流 美学 观念 潜移默化 蔓延 整个 中國 出現 御 窑厂 瓷器 之上 最 闪耀 例子 便是 嘉靖 一朝 烧造 五彩 魚藻 纹 大罐 魚藻 罐上 这卷 魚图 切合 晚明 文人 崇尚 返璞归真 稚拙 可爱 美学 思想 … … 高度 拔 高 过度 平滑 软文 写 … … 佳士得 高人 全文 ,0,1,0,0
雨过 脚云婪 尾 垂 夕阳 孤鹜照 飞时 泥澄铁 镟 丹砂 染 此碗 陶 成色 肖之 民谚 有云 想 穷 烧 红 民间 说法 quot 千窑 一宝 quot 实际上 自永宣创 祭红 之后 官窑 几成 绝响 直至 清康熙 时 方始 重烧 民间 极少数 顶尖 高手 能够 烧造 御 窑厂 每次 烧红 亦 大大 挑战 上百 炉 窑 火中 才   全文 ,0,1,1,0
聚焦 瓷都   陶瓷 知识   丨 手绘 仿 清乾隆 斗彩 缠枝 花卉 纹 长颈 瓶 乾隆帝 十全 武功 标榜 丰功伟绩 好大喜功 支配 下 要求 景德镇 御 窑厂 烧 出 奢华 艳丽 繁复 瓷器 满足 日益 膨胀 虚荣心 此器 外壁 器腹白 地上 通绘斗彩 缠枝 花卉 其花 鲜叶 绿 五彩缤纷 花卉 争奇斗研 来源 长物 居美瓷     ,0,1,1,0
发表 博文 松石 釉 洗 松石 釉 指其 釉色 为仿 绿松石 研发 单 色釉 松石 釉始 见 于明初 乾隆 时 广泛 运用 色泽 上 乾隆 松石 釉 更为 纯正 它常 用于 碗 盘 瓶作 内 釉 此后 历朝 皆 使用 现象 图为 乾隆 御 窑厂 松石 釉 洗 ,0,1,0,0
不 知道 东阳 木雕 城 明代 霁 红 代表 至高无上 皇权 严格 等级制度 全部 御窑 烧制 民窑 不许 生产 违犯 此规 严重者 杀头 之罪 保证 皇家 对霁红 釉瓷 器 垄断 御 窑厂 生产 霁 红 釉瓷 器 残破 瑕疵 一律 打碎 深埋 片红 不得 流入 民间 12 届 中国 东阳 木雕 竹编 工艺美术   全文 ,0,1,0,0
瓷器 艺术 范 回青 称 佛头 青 回青 料 纯然 一色 蓝中 透 紫 苏麻离 青 平等 青色 调 不同 明代 正德 晚期 嘉靖 隆庆 万历 景德镇 御 窑厂 使用 一种 进口 原料 石子 青 配制 回青 料 比例 稍 高 青花 便 呈色 浓艳 红 紫 石子 青用 呈色 便 灰 蓝 ,0,1,0,0
了解 华夏 文明 传承 中华文化 豆 青釉 三足炉   乾隆 直径 26CM 清代 单 色釉 瓷器 明代 单 色釉 瓷器 基础 上 进一步 发展 雍正 末年 唐英 lt 陶成 纪事 碑 记载 当时 御 窑厂 烧制 釉 彩达 57 大部分 单 色釉 瓷器 大量 传世 品 证实 清代 单 色釉 瓷器 既有 仿古 创新 成就 超越 前 代 充分体现 瓷器 生产   全文 ,0,1,1,0
瓷器 艺术 范 百花 不 露地 又名 万 花纹 万花堆 出现 清雍正 流行 乾 嘉 时期 因器 身满饰 各色 花朵 百花 堆聚 又名 百花 图 诚如 陶雅 称 乾隆 华缛极 精巧 致 鬼斧神工 景德镇 御 窑厂 督陶官 唐英 制瓷 工匠 集体 智慧 结晶 ,0,1,1,0
兽 行迹   景德镇 印象 御 窑厂 龙珠阁 古 遗址 胜利 路 几个 片段 拼凑 成 一幅 景德镇 印象 画卷 精美 瓷器 古朴 建筑群 雄奇 楼阁 遗刻 适宜 步行 街巷 走 景德镇 中 步伐 去 丈量 不大 城市 吃 辣 新鲜 口味 不由得 喜欢 上 这种 恬静 悠然 感觉   景德镇 龙珠阁 ,0,1,0,0
聚焦 瓷都   御 窑厂 活动 值得 看 1 珍宝 重光 景德镇 珍品展 赴 荷兰 回归 汇报 展 地点 御窑 工艺 博物馆 四百多年 前 景德镇 精美 陶瓷 荷兰东印度公司 商船 远渡重洋 运往 欧洲 大陆 荷兰 代尔夫 特 重要 港口 景德镇 青花瓷 影响 下 代尔夫 特 生产 蓝陶 逐渐 成为 代尔夫   全文 ,0,1,0,0
景德镇 新闻   景德镇 御 窑厂 遗址 申报 世界 文化遗产 条件 意义 中国 传统 陶瓷 发展 经历 相当 漫长 历史 时期 种类 繁杂 工艺 特殊 由北到 南 涌现 著名 窑口 形成 不同 窑系 往往 都 伴随 历史 朝代 兴衰 更迭 时断时续 没有 形成 历史 延续性 景德镇 窑系 目前 发掘 确认   全文 ,0,1,1,0
瓷器 仿 清雍正 斗彩 祥云 纹水盂 水 丞 清代 雍正帝 追思 明代 成化 斗彩 美妙 本人 品味 脱俗 超群 审美 要求 近乎 苛刻 即位 以来 不懈努力 推动 指导 景德镇 御 窑厂 摹 制成 窑 故所仿 最精 形神 俱佳 粉彩 使用 使 雍正 斗彩 传统 斗 彩绘 画 更加 精细 工致 更 富有 表现力 东家 网页 链接 ,0,1,1,0
探秘 皇家 御 窑厂   昼间 白烟 掩盖 天空 夜则 红焰 烧天 这是 当年 景德镇 千年 窑火 写照 景德镇 御 窑厂 元代 明 清 两代 御用 瓷器 专门 制造 场所 代表 明清 时期 中国 陶瓷 技术 艺术 最高 水平 御 窑厂 遗址 背景 环境 研究 御 窑厂 历史沿革 管理制度 烧造 工艺 重要依据 研究 中国 瓷   全文 ,0,1,1,0
发表 博文 窑变 釉尊 窑变 釉 属于 颜色 釉 中 特殊 品种 所谓 窑变 指 瓷器 施完 釉衣 放置 窑炉 焙烧 过程 中 高温 还原 作用 使胎 釉 中 微量元素 产生 变化 出现 五彩斑斓 色泽 变化 现象 图为 雍正 御 窑厂 生产 窑变 釉尊 ,0,1,1,0
