想象 厚实 便宜 好看 颜值 高 打卡 早饭 很棒 一套 妈妈 买 一套 ,1,1,1,0
这款 好久 双十 终于 下手 感觉 6L 好大 写 足够 颜值 红色 盖子 很漂亮 舒服 喜欢 ,0,1,0,0
家里 砂锅 好几个 想 买 中等 偏小 容量 砂锅 做 煲仔饭 买 两只 同款 大小 收到 满意 做工 不错 锅盖 拉手 设计 顺手 完美 煲仔饭 未 做 炖 蟹黄 豆腐 做 肉汤 馄饨面 ,0,-1,1,0
药锅 收到 疫情 期间 物流 挺快 发货 收货 两天 锅 质量 质地 紧密 锅体 光泽 一看 产品 ,0,0,1,0
块 盘子 质量 不错 物流 师傅   破 ,0,0,1,0
美观 程度 把手 处有 缺陷 ,0,1,-1,0
很漂亮 性价比 高,1,1,1,0
外观 绝美   容量   全家人 开心 煲汤   卖家 送 防烫 垫   比心 ,0,1,1,0
整体 不错 美观大方 碗 碟 勺子 筷子 包装 仔细 磕碰 损坏 碗 碟子 厚度 骨瓷 稍微 厚 手里 适中 ,0,1,1,0
几天 忙 砂锅 来炖 好吃 忘 评价 说 款 砂锅 价格便宜 质量 超好 炖 东西 味道 煮粥 特别 香 糯 内外 清洗 唯一 买 缺 一把 长柄 木勺   朋友 买 不错 ,1,0,1,0
漂亮 套装 美观 实用 ,0,1,1,0
京东 购物 体验 满意 性价比 高 发货 到货 很快 包装 严密 瓷 毫发无损 ,1,0,1,0
外观 包装 包装 完整 损坏   美观 程度 预期 放在 拉篮里 标准   性价比 高 ,1,1,1,0
外观设计   美观 程度   实用 效果 泡 花茶 喝 满意 ,0,1,1,0
实物 图片 花纹 难看 感觉 失落 图片 中 高级 感 ,0,-1,0,0
包装 物流 物美价廉 愉快 沟物 体验 ,1,1,0,0
买 炊大皇 锅 质量 不错 物美价廉 砂锅 发现 炊大皇 果断 选择 砂锅 分量 砂锅 煲汤 煮粥 ,1,1,1,0
套餐 具 本次 回购 款 表面 瓷釉 质地 光滑 色 均匀 美观 包装 做 细心 周到 产品 间隙 放置 防滑 隔膜 釉面 损伤 减少 运输 途中 导致 损坏 勺子 做 紧致 捆绑 包装箱 不用说 采用 防 碰撞 泡沫 材质 细节 满意 购物 ,0,1,1,0
包装 不错 想 买 套 碗 具 正好 碰到 陶瓷 雕刻 花纹 美观大方 实用 效果 值得 推荐 拥有 东西 ,0,1,1,0
好看 家里 买 一组 过年   一整套 好看 质量 很棒 家里 特意 买 一整套 美观 实用 推荐 包装 ,0,1,1,0
包装 碗碟 很漂亮 质量 不错 价格 实惠 ,1,1,1,0
昨天下午 分 下单 中午 收货 质量 厚实 砂锅 客户 请 放心 购买 特别感谢 小哥 张旭 冒雨 送货 辛苦 ,0,0,1,0
外观 包装 包装 牢固   美观 程度 美   商品   体验 赞   瓷质 效果 优质   隔热 效果 烫手 ,0,1,1,0
买 正确 不像 说 破 碎 完好无损 满意 很漂亮 喜欢 ,0,1,1,0
包装 破损 盘子 大小 均匀 质量 买 质量 ,0,1,1,0
第一次 购买 不错 一套 款式 清新 淡雅 很漂亮 磁质 细腻 大小 合适 隔热 效果 不错 京东 物流 力 五星 好评 ,0,1,1,0
砂锅 开锅 煮 米粥 炖 排骨 小火 慢炖 大小 颜值 满意 白色 黑 锅底 用过 三次 锅底 黑 值得 购买 ,0,1,0,0
破 补 ,0,0,-1,0
买过 他家 奶锅 感觉 不错 砂锅 价格 美丽 东西 不错 分量 足够 大小 合适 煲汤 特别 好喝 保温 性能 全 五分 奈斯 奈斯 ,1,1,1,0
太漂亮 超 喜欢 开心 购物 ,0,1,0,0
锅 收到 速度 特别 包装 到位 本来 磕碰 坏 发现 包裹 到位 磕碰 砂锅 质量 不错 沉甸甸 棒 ,0,0,1,0
穿 效果 款式 不错 喜欢 细节 到位 做工 水平 高 ,0,1,1,0
昨天晚上 下单 今天上午 收到 在家 帮忙 放在 超市 里 回来 第一 时间 回来 包装 喜欢 好看 留着 搬 新 家用 ,0,1,0,0
确实 不错 图片 一模一样 掌柜的 送 螺丝刀 包装 美中不足 物流 太慢 ,0,1,0,0
外观 包装 包装 设计   美观 程度 千叶 真 好看   商品 特色 质感   体验 大小 适中 盘中 深 滴 汤   瓷质 效果 瓷质 细腻 光滑 摸 手感   隔热 效果 隔热性 不错 ,0,1,1,0
家里 砂锅 盖子 坏 盖 不严 赶上 双十 买 很漂亮 苏泊尔 很多年 牌子 放心 砂锅 大小 合适 四个 做 汤 ,0,1,-1,0
表面 手感 润滑   手工 工艺 精致   实用 效果 满意   外观设计 时尚 ,0,1,1,0
上午 买 下午   星座 杯 买 好看 朋友 买 喜欢 高大 泡茶 咖啡 一杯 搞定 推荐 ,0,1,0,0
不错 产品 熬药 买 小巧 占 地方 产品质量 速度 很快 三天 到货 包装 严实 熬药 效果 不错 ,0,1,1,0
中国 最慢 语 歺 具 不错   外观 包装 泡沫 箱 防振   美观 程度 不错   商品 盘子 碗 深 家庭 实用 勺子 很深 勺 柄 很长 不错 筷子 价 很值 东西 家庭 不错 陶瓷 细腻 ,1,1,1,0
锅子 炖 红烧肉 一绝 性价比 高 简单 好看 包装 实在 锅 ,1,1,1,0
很棒 工艺 外形 好看   美观 程度 好看 买 第二个   外观设计 漂亮   表面 手感 完美   手工 工艺 完美   实用 效果   特色 ,0,1,1,0
收到 开箱 一步 惊喜 包装 完善 一点 破损 产品 单独 包 固定 结实 拆开 产品质量 洁白 亮丽 个件 摆出来 精美 瓷器 当天 洗 一遍 碗柜 里 碗 盘碟 换成 新 晚上 吃饭 盛菜 摆盘 单看 很漂亮 良心 商品 良心 店家 好评 ,0,1,1,0
看着 质量 不错 包装 严实 ,0,0,1,0
外观 包装   体验 感觉 还好 没用   美观 程度 照片 相符 ,0,1,0,0
收到 打开 验货 打开 发现 汤碗 烂 包装 不好 ,0,0,-1,0
第二次 购买 砂锅 家里 买 炖肉 特别 香 颜值 不错 ,0,1,0,0
炒鸡 可爱 图片 原以为 很小 没想到 拿到 手后 发现 体积 特别 可爱 ,0,1,0,0
外观 包装 包装  严实 破损   商品 高大   美观 程度 很漂亮   喜欢 ,0,1,1,0
宝贝 很赞 喜欢 日式 风格 外观 包装 损坏 运输 完好无损 很快 到达 谢谢 卖家 贴心 服务 希望 款式 选择 期待 下次 回购 ,0,1,1,0
包装 完好无损   图片   开心 购物 ,0,0,1,0
煲汤 煮肉 特别 味道 特别 加热 这套 锅 深浅 大小 合适 洗起来 煮肉 煲汤 够 一家 三口 吃 ,0,1,0,0
棒棒 哒   颜值 高   关键 便宜   ,1,1,0,0
漂亮 咖啡杯 大小 适中 外面 釉 光滑 细腻 锃亮 星座 花纹 简单 好看 ,0,1,1,0
杯子 好看 速度 当天 比较满意 ,0,1,0,0
质量 巨 收到 货 妈 赞美 双十 活动 五折 优惠券 买 大元 划算 我妈 说 外面 多买 质量 感觉 赚大 便宜 哈哈哈哈 牌子 质量 杠杠 滴 ,1,0,1,0
精致 漂亮 美 颜色 复古 看着 舒服 象 一件 工艺品 舍不得 往里 放 烟灰 0.01 元 抢 妥妥 物美价廉 ,1,1,1,0
点个 赞 京东 物流 做 太好了   沙锅 作工 精细 光滑 细腻 锅体 材料 厚实 外观 漂亮 不错 够物 ,0,1,1,0
很漂亮 质量 不错 实用 办公 必备 ,0,1,1,0
好看 碟子 正好 厚实 瓷好 一家 三口 正好 够用 ,0,1,1,0
包装 完好无损 做工 精致 漂亮 放在 酒柜 效果 不错 值得 拥有 五分 ,0,1,1,0
挑 好久 最终 选择 砂锅 熬 中药 砂锅 裂 选 小心 质量 不好 炸裂 差评 ,0,0,-1,0
物流 很快 包装 结实 碗 好看 价钱 划算 家里 碗 正好 配 一套 缺点 外包装 泡沫 箱 拆开 弄 处 颗粒 泡沫 ,1,1,0,0
美观 程度 特别 漂亮   表面 手感   手工 工艺 特别 艺术 感   实用 效果 实用性 很强   特色 式 特别 ,0,1,1,0
最少 点 一颗 星星 一颗 不想 收到 货 好几个 勺子 残次品 换 货 邮寄 一套 商品 乱七八糟 拼凑 态度 买前 一个样 买后 一个样 小旋 态度 极差 差评 ,0,0,-1,0
高端 大气 上档次 哒 哒,0,1,0,0
这款 碗 具 套装 不错 很漂亮 做工 精细 ,0,1,1,0
包装 物流 纯白 家人 喜欢 ,0,1,0,0
头 感觉 喝个 水 高端 大气 上档次 ,0,1,0,0
杯子 外观 好看 价格 不贵 ,1,1,0,0
咖啡杯 用作 冲泡 黑芝麻糊 大小 正合适 杯子 质量 结实,0,1,1,0
质量 做工 精细 外观 质感 很棒 陶瓷 实用 烟灰缸 艺术品 摆件 颜色 搭配 好看 包装 严实 破损 发货 速度 满意 ,0,1,1,0
仔细 瓷杯 看成 搪瓷 杯 东西 做工 不错 ,0,0,1,0
陶瓷 碗 首选 景德镇 陶瓷 京东 逛 选择 浩雅 陶瓷 买 两套 陶瓷 碗碟 元 头 性价比 超高 到货 包装 ,1,0,1,0
收到 一整套 完好无缺 很漂亮 ,0,1,1,0
京东 速度 没话说 隔天 送货上门 家里 京东 买 这款 砂锅 三年 果断 买   价格 款 砂锅 性价比 高 赶上 活动 优惠   容量 容量 很足 够 一家 三口 质感 赞 手里 挺 厚实 毛边 顺滑   感受 说明书 开锅 保养 煲 汤 味道 很浓 很香 ,1,1,1,0
外观设计 外观 简约   手工 工艺 工艺 不错 质感 ,0,1,1,0
看着 老式 搪瓷 杯 实际上 陶瓷杯 手感 细腻 喝水 一种 书记 感觉 年代 感 ,0,0,1,0
美观 程度 蓝色 很漂亮   外观设计 上窄 宽   表面 手感 瓷感   手工 工艺   实用 效果 生活 中 喝水   特色 加 杯盖 勺子 省 麻烦 针 戳 ,0,1,1,0
包装 完整 破损 图案 清晰 喜欢 ,0,1,1,0
图案 很漂亮 喜欢 盘子 搞 活动 买回来 一套 能用 发了 满分 ,1,1,0,0
看着 瓷锅 釉色 均匀 熬药 大小 正合适 便宜 实用 ,1,1,1,0
外观 包装   美观 程度 很漂亮   商品 物美价廉   瓷质 效果 光滑   隔热 效果 完美 ,1,1,1,0
京东 物流 不错 速度 隔天 值得 信赖 煮汤 锅 用起 煲 汤 大小 合适 够 一家 ,0,1,0,0
包装 破损 质量 做工 精细 打开 好看 高度 合适 咖啡 喝水 装 开水 烫手 配 勺子 精致 ,0,1,1,0
砂锅 宝贝儿 这门 很棒 砂锅 主要用途 煲汤 蒸饭 蒸菜 煮粥 煎药 砂锅 制作 食物 保汁 保味 食品 色泽 鲜美 砂锅 均匀 持久 外界 热能 传递 内部 食材 平衡 环境温度 砂锅 有利于 水分子 食物 渗透 煨 食品 质地 越加 酥烂 ,0,0,1,0
美观 程度 好看   表面 手感 不隔温 倒 热水 杯体 烫   实用 效果 容量 350 毫升 泡 咖啡 刚刚 ,0,1,1,0
材质 做工 精细 ,0,0,1,0
妈妈 买 砂锅   爸爸 平时 爱 喝汤   砂锅   正好 京东 溜达   这款 合适 砂锅   大小 合适   锅内 深浅   正好 适合 两三个 煲汤 喝   买回来 爸爸妈妈 满意   正好 坐月子   熬 几次 汤   味道 鲜美 ,0,1,0,0
很漂亮 没坏 包装 专业 结实 盘子 深 盘子 装 麻婆豆腐 那种 勾芡 菜 那种 西餐 那种 浅盘 喜欢 碗 较大 好看 ,0,1,1,0
配送 速度 很快 包装 磕碰 情况   品质 砂锅 质地 预想 炖 两只 老母鸡 三口 家 建议 买 一号 ,0,0,1,0
材料 做工 特别 精致 做工 棒 觉着 推荐 朋友 买 感觉 不错 挺 喜欢 纯色 盘子 底部 防滑 ,0,1,1,0
美观 程度 挺 好看   瓷质 效果 质量   美观 程度 好看 ,0,1,1,0
物流 超快 杯子 挺 好看 完好无损 描述 字 ,0,1,1,0
外观 包装 泡沫 箱子 保护   美观 程度 优雅 气质 型 花费 几个 一批 同款 凑 一桌   商品 简单 大方 瓷 细腻 棒   体验 没舍得 太爱 摔 东西 我怕部 小心 摔   瓷质 效果 细腻 看着 高级   隔热 效果 没用 感觉 肯定 不错 ,0,1,1,0
不错 漂亮 值得 购买 ,0,1,0,0
不错 很快 包装 损坏 质量 外观 好看 瓷质 不错 隔热 效果 不错 下次 ,0,1,1,0
物流 很快 外观 漂亮 喜欢 一家 三口 炖汤 肯定 够 再来 追评 感觉 不错 喜欢 ,0,1,0,0
外观 包装 包装 精美 结实 耐用   美观 程度 完美 看着 高档 颜色 搭配 很赞   商品 头 价位 低 划算   体验 光滑 斑点 硬点   瓷质 效果 瓷质 效果 挺   隔热 效果 隔热 没用 追评 ,1,1,1,0
包装 收到 宝贝 完整 晚上 第一 这用 锅 质量 不说 美不美 实用 哥哥 打电话 说 宝贝 送到 家 服务 ,0,1,1,0
物美价廉 一套 碗 碟子 筷子 勺子 套装 总价 不到 三十块 钱 实在 太 实惠 刚刚 刷 一遍 破损 瑕疵 确实 做工 满意 ,1,1,1,0
家里 从大到 朋友 喜欢 套餐 具 可爱 简单 情侣 碗 吃面 吃 米 吃 菜 OK 隔热 设计 深度 大小 很棒 值得 推荐 ,0,1,1,0
款 砂锅 大小 合适     三口 家用 足够     足够     锅 质量   挺 厚实     重量 肯定 重点     用过 几次     焖 东西 好吃     推荐 购买 ,0,1,1,0
包装 特别 很漂亮 很大 质量 结实,0,1,1,0
国瓷 冲量 质量 不错 价格便宜 值得 点个 赞 ,1,0,1,0
熬药 特意 买 特别 特别 棒 货比三家 买 本来 担心 买 拿到 发现 容量 够用 熬粥 炖汤 实用 物流业 满意 购物 ,0,1,1,0
精致 一款 陶瓷杯 颜值 高 送 勺子 充满 金属 质感 泡 一杯 麦片 异味   京东 自营 品牌 物美价廉 适合 上班族 学生 党 无论是 泡 早餐 麦片 休闲 饮品 合适 五星 好评 ,1,1,1,0
包装 完美 纸质 包装箱 泡沫 缓冲 包装 缓冲 包装 碗 固定 运输 过程 中 损坏 碗 品质 不错 商品 搭配 饭碗 盘子 汤碗 汤勺 烫 勺 尺寸 大小 适合 家庭 ,0,1,1,0
棒 砂锅   煲汤   炖肉   煮粥 样样   优点 不粘锅 保温  特别 打理   一家 三四口 量   炖 肉 肉 超级 香   大人 孩子 特 喜欢  好看 喜欢 亲们 错过   特别感谢 小哥 贴心 服务 ,0,1,1,0
汤煲 大小 合适 表面 平滑 适合 煮粥 煲汤 口人 合适 头 天下   第二天 收到 品牌 值得 信任 京东 物流 方便快捷 ,0,1,1,0
包装 精致   感觉 不错 ,0,0,1,0
好看 美观大方 绿色 喜欢 色号 ,0,1,0,0
外观 很漂亮 设计 新颖 小象 喜欢 第一次 发货 瑕疵 申请 售后 京东 依旧 放心 一如既往 信任 京东 ,0,1,-1,0
漂亮 颜值 高 想象 中 想象 中 漂亮 买来 炖鸡汤 喝 打开 卡片 建议 第一次 淘米水 煮 延长 受用 问 说加 一半 水煮开 疫情 期间 外面 吃饭 逼成 大厨 更要 好好 养养 胃 ,0,1,0,0
喜欢 一两个 大小 很漂亮 ,0,1,0,0
看来看去 选择 款 爱仕达 砂锅 红色 盖子 黑色 锅身 很漂亮 外面 光滑 买 一周 炖 几次 粥 青菜 瘦肉粥 小米粥 米粥 还炖 鸡汤 排骨汤 好喝 高压锅 炖 好吃 好多 砂锅 买 空间 适合 一家人 ,0,1,1,0
昨天 今天上午 收到 药锅 外观 漂亮 大小 合适 实用 ,0,1,1,0
外观 包装   美观 程度 很漂亮   商品 精致 碗盘 ,0,1,1,0
宝贝 收到 颜色 好看 质感 样子 简单 想要 一点点 瑕疵 店家 整体 不错 好评 ,0,1,1,0
砂锅 厚重 加热 水 开裂 放心 大小 合适 一家 三口 炖汤 足够 满意 ,0,1,1,0
完好无损 很漂亮 下次 还会 光顾 ,0,1,1,0
前 几天 超市 盘子 花里胡哨 满意 京东 选 纯白色 盘子 拿到 手 挺 满意 做工 不错 盘子 圆整 ,0,1,1,0
不错 杯子   好看   容量   物流 一级 ,0,1,0,0
杯子 很漂亮 干净 包装 用心 说好 ,0,1,0,0
美中不足 底座 粗糙 划手,0,1,-1,0
高端 大气 ,0,1,0,0
不错   碗 很漂亮   性价比 高   爱 爱 ,1,1,1,0
包装 严实 完好无损 外观 颜值 高 图案 清新 太 可爱 哥哥 细心 ,0,1,1,0
说明书 讲 先烧 一锅 面汤 稀饭 烫 大方 好看 颜色 特别 特别 钟意 ,0,1,0,0
包装 严实 打开 破损 暂时 用不上 先放 ,0,0,1,0
折 活动 太 划算 家里 盘子 完 买来 一套 质感 图案 很漂亮 ,1,1,1,0
外观 赞 买 2.5 L 容量 概念 拿到 手里 一看 真大 ,0,1,0,0
锅 质量 特别 好 超市 物流 不愧 京东 郭氏 我家 利用率 顿菜 好吃 推荐 购买 ,0,0,1,0
美观 程度 外边 美观 顺滑   外观设计 造型 独特 颜色 亮丽 红色 喜庆   表面 手感 手感 很棒 毛刺 感觉 ,0,1,1,0
盘子 性价比 高 包装 收到 商品 完好无损 质量 价格 这放 价格 不错 盘子 厚实 耐用 ,1,0,1,0
碎   实体店 质量 不好 建议 实体店 购买 ,0,0,-1,0
还行 挺 分量 结实 图片 相符 绝美,0,1,1,0
想买个 砂锅 炖汤 喝 京东 款 外观 很漂亮 评价 不错 信赖 京东 果断 下单 昨天下午 中午 确实 很漂亮 很大 估计 够 五个 喝 不错 ,0,1,0,0
外观 包装   美观 程度 很漂亮   商品 精致   体验 光滑   瓷质 效果 光洁 如玉   隔热 效果 耐高温 ,0,1,1,0
东西 碗 好看 ,0,1,0,0
愉快 购物 杯子 外观 炫 质量 可以 值得 购买 实惠,0,1,1,0
包装 完好 仔细检查 瑕疵 大小 正好 满意 ,0,1,1,0
太 实用 够 适合 大家庭 实用 ,0,0,1,0
砂锅 超级 可爱 外观 简单 大方 厚实 釉 光亮 整体 美观 瑕疵 图案 特别 大小 刚刚 防 烫手 柄 特别 京东 物流 超级 第二天 到货 送到 家 京东 购物 省心 省力 赞 ,0,1,1,0
外观 包装 包装 美丽 大气 实惠 商场 那种 两三百 没什么 差别   美观 程度 做工 发现 瑕疵 图案 精美   商品 一整套 非常适合 一两个 特别 在外 工作 年轻人   瓷质 效果 手感 细腻   隔热 效果 两天 微波炉 热菜 稍微 一会儿 手端 手套 毛巾 隔热 效果 不错 ,1,1,1,0
很漂亮 杯子 物流 超快 次日 达 容量 够 做工 细致 送 小勺 满意 好评 ,0,1,1,0
好看 图片 漂亮 真没想到 ,0,1,0,0
疫情 拖 几天 收到 包装 紧密 不易 磕碰 完好无损 锅体 很漂亮 做工 细致 导热 很快 清洗 大小 足够 外观 美丽 满意 京东 自营 物流 很快 京东 员 服务态度 满意 购物 ,0,1,1,0
包装 温暖 紧实 烂 情况 ,0,0,1,0
挺 好看 满意 哈哈哈哈 包装 ,0,1,0,0
包装 用心 到位 损坏 盘子 质量 结实,0,0,1,0
杯子 容量 很大 适合 拿来 喝咖啡 燕麦 ,0,1,0,0
汤碗 收到 包装 严实 图案 好看 大小 合适 底座 厂名 标识 感觉 三无 厂 生产 第四个 图是 盘 写字 底盘 写字 告诉 生产 ,0,1,1,0
烟灰缸 做出 艺术品 绝美 价格 实惠 还配 起子 想得 周到 当个 礼品 送给 值得 家庭 拥有 东西 值得 推荐 购买 ,1,1,0,0
砂锅 外观 很漂亮 红色 盖子 颜色 很正 釉面 光滑 砂锅 底部 平整 颜值 高   大小 适合 煮粥 煲汤 炖菜 煮粥 小火 慢炖 粥 粘稠 电饭锅 煮 好吃 煲汤 味道鲜美   砂锅 传热 中火 小火 就行 保热 性能 汤 菜 放 凉 适合 冬天   清洗 锅内 沾油 图 烧 几次 锅底 干净 锅灰 ,0,1,1,0
美观 程度 不错   外观设计 挺 好看   表面 手感 光滑 质感   实用 效果 喝咖啡 喝牛奶 不错 ,0,1,1,0
锅 收到 包装 破损 容量 很大 够 几个 一顿 吃 颜色 不错 质量 感觉 还好 沉甸甸 没用 期待 效果 ,0,1,1,0
简约 风格 小巧 精致 ,0,1,1,0
刚买 货 十分钟 采购 赶紧 下单 第二天 一大早 送来 发现 完整 破损 满意 期待 推荐 下单 棒 ,0,0,1,0
喜欢 大小 合适 包装 严实 满意 ,0,1,1,0
美观 程度 好看   表面 手感 挺舒服   手工 工艺 做工 不错 ,0,1,1,0
符合 图片   表面 手感 圆润   美观 程度 符合 预期   实用 效果   特色 暂时 发现 ,0,1,1,0
拆开来 检查 一遍 有没有 破损 完好无损 暂时 用不上 赶着 活动 价 五十九 元 买 买来 屯着 平时 摔坏 替上 没全 拆出来 破损 颜值 特别 高 喜欢 款 我家 母亲 说 好看 勺子 特别 感觉 ,1,1,1,0
喜欢 大小 合适 宿舍 两个 人用 刚刚   外观 包装 包装 严实 ,0,1,1,0
陶瓷 偏重 那种 铁 做 外面 一层 瓷 ,0,0,-1,0
质量 不错 一段时间 ,0,0,1,0
东西 精致   价格 实惠 ,1,0,1,0
超级 喜欢 烟灰缸 小金 鹿 金属 很漂亮 物流 很快 总得来说 物美价廉 赞 ,1,1,0,0
沙锅 收到 京东 物流 挺快 隔天 收到 挺 满意 外观 很漂亮 材质 厚实 大小 合适 想要 信赖 苏泊尔 产品 买 沙锅 挑选 牌子 品牌 品质 信得过 价格便宜 一百块 钱 不到 购物 太 满意 ,1,1,1,0
满意 一款 杯子 赠送 勺子 杯盖 绝美 设计 放小 勺子 ,0,1,0,0
套装 碗碟 质量 手里 重重 感 摸 厚厚的 结实 喜欢 ,0,0,1,0
外观 包装 大方   美观 程度 精致   商品 特色   体验   瓷质 效果   隔热 效果 ,0,1,1,0
很漂亮   送 杯 垫 包装 严实 一点 磕到 地方   喜欢 ,0,1,1,0
太 喜欢 品质 出乎意料 景德镇 关键 物美价廉 回头 妈 买 一套 送给 我姐 一套 喜欢 建议 稍微 厚 一点点 质感 总体 感觉 十分满意   外观 包装 简约 大气   美观 程度 优秀   商品 轻盈 高质   体验 超 喜欢   瓷质 效果   隔热 效果 ,1,1,1,0
破损 包装 完整 家里人 喜欢 ,0,0,1,0
不错 图片 里 一模一样 烟灰缸 很漂亮 ,0,1,0,0
外观 挺       很大       煮 东西 ,0,1,0,0
大小 合适 煮粥 煲汤 味道 好看 ,0,1,0,0
美 体现 景瓷 魅力 传统 器具 精美 碗 盘 尺寸 退换 店家 周到 服务 耐心 讲解 不负 我选 一套 上乘 愿望 祝 生意兴隆 品质 第一 ,0,1,1,0
外观 包装 一层 一层 包装 防 碰撞 放心   美观 程度 喜欢 类型 喜欢   瓷质 效果 用过 正品 圆润 光滑 瑕疵   商品 美观大方 bu 俗气   五星 好评 送给 值得 购买 便宜,0,1,1,0
盘子 质量 图案 精致 漂亮 包装 完整 送货上门 好评 ,0,1,1,0
质量 不错 放 屋里 挺 好看 质感 值得 购买 ,0,1,1,0
昨晚 下单 收到 很漂亮 送 热垫 追评 ,0,1,0,0
家里 碗 牌子 打折 屯 活动 特别 划算 质量 不错,1,0,1,0
微重 质感 符合 喜好 ,0,0,1,0
苏泊尔 炖锅 质量 结实 美观 宽口径 放 东西 好放 炖汤 味道 好多 煲汤 小孩子 喜欢 喝 味道 京东 自营 速度 很快 服务 ｀ ´ ,0,1,1,0
摆设 绝美 不错 ,0,1,0,0
19.8 买 一套 离谱 更何况 包装   物品 光洁 如新 送 碗 垫 超市 里 价格 够买 盘子 ,1,0,1,0
大气 上档次 喝咖啡 还配 勺子 ,0,1,0,0
卖家 包装 破损 瓷质 细腻 白皙 高档 推荐 购买 ,0,1,1,0
朋友 圈里 晒 酸梅汤 做 想法 果断 买 乌梅 陈皮 甘草 发现 少 工具 爱仕达 搞 活动 果断 入手 产品 配色 舒服 做工 精湛 做 酸梅汤 ,1,1,1,0
精致 精美 握持 舒适 杯口 润滑 杯子 ,0,1,1,0
确实 精致 送给 朋友 包装 太 严实 坏 ,0,0,1,0
京东 物流 一如既往 杯子 大小 合适 设计 挺 好看 包装 用心 买来 泡 麦片 勺子 木头 包住 隔热 保温 烫手 整体 挺 ,0,1,1,0
想 买 砂锅 选择 最终 选择 网上 款 苏泊尔 爆品 销量 领先 收到 查看 实体 细 斑点 釉面 很光 清洗 开锅 炖 鸽子 汤 物美价廉 品牌 值得 信赖 喜欢 ,1,1,1,0
一家 三口 建议 买大 一号 喜欢 ,0,1,0,0
质量 所见即 所得 放心 购买 ,0,0,1,0
挺 实用 能放 中药 加热 挺快 挺好用 吃 完 中药 再煲 砂锅 粥 价格 挺 实在 送 很快 ,1,0,1,0
买 两个 服务 还好 款 舍得 发来 杯口 椭圆形 懒 换 扔 ,0,0,-1,0
说起 说 差 包裹 严严实实 杯子 盖子 分开 包着 杯子 没什么 磕碰 不错 ,0,0,1,0
心仪已久 煲汤 神器 相中 红 黑配 简洁 外观 超大 肚量 够用 材质 光滑 质感 未 整体 感觉 满意 双十 期间 到货 也給 好评 ,0,1,1,0
美观 程度 很漂亮   外观设计 挺棒   表面 手感 摸 舒服   手工 工艺 精良 ,0,1,1,0
喜欢 碗 大小 适中 白色 好看 京东 物流 速度 真是太 ,0,1,0,0
瓷质 效果 圆滑 透亮 ,0,0,1,0
大小 正合适   重量 够 材质 光滑 非常容易 清洗   熬起来 ,0,1,1,0
物品 包装 完美 破损 商品 外观 美观 大气 质重 合适 手感 不错 瓷质 厚度 确当 平面 度 圆整 度 欠 一点 ,0,1,1,0
昨晚 点 下单 早上 九点半 送到 家 东西 好够 外观 完整 包装 没用 几天 用过 追评 京东 不错 ,0,1,1,0
不错 砂锅 大小 合适 颜值 高 打开 箱子 那刻 惊艳 想法 价位 合适 买 锅 附赠 手套 隔热 垫 贴心 京东 哥哥 力 久 态度 不错 ,1,1,1,0
物流 晚上 下单 第二天 上午 收到 质量 杠杠 大小 合适 希望 煲 菜 汤 支持 京东 ,0,1,1,0
挺       活动 买 挺 合适       稍微 瑕疵 接受       服务       包装 ,1,0,1,0
精致 美观大方 大小 合适 易 冲洗 物流 力 ,0,1,1,0
很漂亮     手感     制 工艺 给力     很漂亮     喜欢     力     666666 信赖 京东 自营 ,0,1,1,0
美观 程度 杯子 好看 态度 盖子 精致,0,1,1,0
外观 包装 外观 包装 保证 瓷器 破损 美观 程度 陶瓷 很白 光滑  体验 ,0,1,1,0
买 煲汤 品牌 值得 信赖 质量 买 4.6 L 刚刚 适合 一家 四口 煲汤 推荐 购买 红色 盖子 好看 别出新裁 ,0,1,1,0
物流 真 时期 没想到 包装 完好 实物 好看 美食 做 三黄鸡 汤 ,0,1,1,0
挺大 质量 OK 挺 喜欢 ,0,1,1,0
太 好看 质量 包装 特别 泡沫 层 包裹 砂锅 特别 紧 掰 不开 泡沫 掰碎 锅 完好无损 颜值 特别 漂亮 喜欢 砂锅 需求 买 苏泊尔 4.5 l 每次 炖汤 撒 价格 还贵 小熊 这款 颜值 高 价格便宜 质量 杠杠 ,1,1,1,0
商品 收到 咯 特别 好看 喜欢 收到 迫不及待 打开 家人 满意 购物 体验 不错 不错 包装 仔细 价格 贵 还会 买买 买 正品 价格 贵 很大 气 ,-1,1,1,0
菜盘 不错 整整 价格 合适 送货 很快 包装 一点 破损 盘子 质量 挺不错 挺 厚实 盛菜 寸 不错 大小 合适 盘子 白色 纯色 白搭 包装 完好无损 失望 运输 包装 易碎品 用心 六个 菜 盘子 厚实 瓷质 细腻 易清洗 做工 质量 行 瑕疵 物美价廉 外观 瓷质 洁白 光滑 彰显 简洁 大气 商品 店家 描述 满意 购物 品质 棒棒 哒 洁白 简洁 美观 好看 花哨 实惠 大小 合适 常用 尺寸 滑 掉落 ,1,1,1,0
早上 下午 收到 京东 自营 速度 真心 一万个 赞 爱仕达 品牌 喜欢 明星 孙俪 娘娘 代言 爱屋及乌 收到 货后 发现 宝贝 完好无损 锅盖 锅身 一点 瑕疵 锅身 内壁 光滑 容量 很大 炖排骨 玉米汤 应是 极好 锅盖 锅身 吻合 做 汤 再来 追评 全 五星 好评 下次 还会 回购 ,0,1,1,0
泡沫 箱 包装 迷你版 收到 满意 盘子 挺大 喜欢 风格 活动 买 点赞 ,1,1,0,0
