文本,价格,外观,质量
速度 没得说 疫情 期间 次日 达 京东 昨天 刚下 发货 京东 物流 很快 师傅 宝贝 包装 损坏 汤煲 厚实 质量 不错 图案 很漂亮 可爱 汤煲 做 汤 手艺 很大 进度 做 汤 种类 想想 美味 汤煲 价格 实惠 关注 亲家 产品 汤煲 赶紧 下手 ,1,1,1
精致 漂亮   一整套 喜欢 ,0,1,1
质量 不错 大小 合适 做工 精良 超级 实惠 ,1,1,1
挺 好看 杯子 厚 ,0,1,1
外观 包装   美观 程度   商品 漂亮   瓷质 效果   隔热 效果 行   体验 食具 胃口 开 干净 漂亮 ,0,1,1
包装 破损   套装 很棒 价格 实在 太香   放进 烤箱 微波炉   厚度 还好 薄 担心 装热 食物 烫手   图案 好好看 吃 东西 香   活动 回购 一套 老家 ,1,1,1
京东 速度 失望 超级 昨天晚上 想着 玩买 盖子 杯子 棒棒 杯子 质量 可以,0,0,1
质量 可以 美观大方 价廉物美 ,1,1,1
两周 煎药 壶 釉面 光滑 手柄 质感 大火 煮 药 开裂 升 容量 够 煎药 时 溢出 传热 保温 不错 火烧 开 转 小火 药 滚 称心 清洗 满意 好评 ,0,1,1
深盘 容量 特别 合适   盛住 汤 ,0,1,0
京东 买 天然 陶瓷 砂锅 煲汤 煲 粥 实用 产品 外形 美观大方 工艺 质感 不错 盖 煲 口 吻合 特别 煲 粥 时 沸腾 煲 盖 振动 发出 响声 粥 水 忘记 溢出 满意 煲汤 煲 粥 味道 煲 值得 推荐 耐用 有待 观察 追评 ,0,1,1
速度 特快 昨晚 点 下单 点 到货 ,0,0,0
盘子 大小 很小 勺子 碎 划手 ,0,-1,-1
造型 很大 气 实惠 好评 值得 购买 ,1,1,0
东西 实物 描述 相符 美观 疫情 送货 慢 ,0,1,0
白色 黑色 看清 锅内 食物 图案 好看 ,0,1,0
实物 图片   颜色 花型 好看   包装   一点 破损   稳稳 拿到 手   员 打开   损坏 质量 不行 ,0,1,-1
送人 大气 体面 ,0,1,0
杯子 颜值 不错 配送 很快 愉快 购物 ,0,1,0
完美 套装 组合 饭碗 盘子 汤勺 汤碗 精美 推荐 购买 ,0,1,0
超级 运输 保护 划算 质量 不错 ,0,0,1
简约 白色 颜值 高 瑕疵 底部 打磨 剌 手 总体 ,0,1,-1
包装 放心 碎 整套 实用 ,0,0,1
景德镇 瓷器 漂亮 包装 一丝 损坏 性价比 高 值得 购买 ,1,1,1
砂锅 包装 严实 外观 很漂亮 可爱 容量 够 熬汤 味道 美味 这是 第二次 购买 咯 ,0,1,1
很漂亮 手感 不错,0,1,1
厚 质量 棒棒 哒 颜值 高 种树 兑换 碗 ,1,1,1
美观 程度 整体 洁白 清新 光滑 亮泽   外观设计 设计 人性化 配有 汤匙   表面 手感 手感 光滑 高亮 总体 一种 大气 感觉   实用 效果 办公 场所 便捷 手柄 设计 符合人体 工程学 握 舒服   特色 图案 设计 好看 ,0,1,1
漂亮 做工 不错 挺 ,0,1,1
评价 几次 这是 第二次 购买 感觉 第一次 买 提出 退换 申请 退换 工作人员 服务态度 物流 很快 感觉 实用 大小 合适 一家人 整体 不错 购物 体验 ,0,1,1
好看 包装 煲汤 做 酸菜鱼 砂锅 煲 汤 味道 鲜美 砂锅 保温 隔热 久 保养 十年 买 家 好多 锅 回购 ,0,1,1
收到 很漂亮 不错 看着 材质 挺好 体验 不错 ,0,1,1
外观 包装 外观 包装 完好无损 美观 程度 好看   商品 大小 正好   体验 喜欢 ,0,1,1
外观 质量 价格 都挺好 ,1,1,1
包装 严实 碗 破损 瑕疵 碗 精美 质量 细腻 光滑 价格 不贵 性价比 挺 高 日常 足够 ,1,1,1
棒 超 喜欢 下次 一套   外观 包装 划破  受损   美观 程度 好看 喜欢 ,0,1,-1
收到 货 包装 完整 破损 图案 清新自然 不错 选择 喜欢 ,0,1,1
碗 盘子 很漂亮 厚实 喜欢 图案 无色差 盘子 挺深 碗 袖珍 适合 女生 喜欢 吃饭 一种 享受 ,0,1,1
收到 杯子 不错 结实 泡 咖啡 泡茶 清洗 好评 哈哈哈哈 推荐 购买 试试 ,0,0,1
锅 煲汤 过年 那天 装 佛跳墙 买 大容量 吃 很大 很大 ,0,1,0
特别 可爱 碗 碟子 性价比 特别 高 卖家 发过来 碟子 破损 卖家  ,1,1,1
妈妈 说 很漂亮 煲汤 正好 收到 货前 担心 ,0,1,0
容量 描述 不符 点 ,0,-1,0
砂锅 不错 质量 买来 儿子 熬粥 糊底 没用过 看着 不错 大小 合适 煮 米线 酸 奶粉 ,0,1,1
杯子 很大 气 瑕疵 细腻 极力推荐 购买 ,0,1,1
经济 实惠 一整套 齐全 颜色 挺 好看 ,1,1,0
盘子 漂亮 装 东西 合适 质量 不错 价格 便宜 反正 款 盘子 买 超值 实惠 买 两套 一套 送人 一套   一举两得 超级 划算 ,1,1,1
很漂亮 质量 挺好 一款 下次 回购 ,0,1,1
砂锅 漂亮 容量 够 四口 家 够 满意 ,0,1,0
瓷碗 好看 性价比 高 ,1,1,1
外观 包装 包装 精美   美观 程度 素雅 清新   瓷质 效果 匀称 细腻   商品 物美价廉   隔热 效果 未 体验 追评 ,1,1,1
上次 买过 黑色 儿子 喜欢 买 几个 白色 好看 ,0,1,0
特意 两天 评价 负责 菜盘 不错 整整 六个 价格 合适 送货 很快 包装 一点 破损 盘子 质量 挺不错 挺 厚实 盛菜 寸 不错 大小 合适 盘子 白色 纯色 白搭 ,1,1,1
物美价廉 一套 够 一到 两人 瓷器 精美 ,1,1,0
外观 包装 好看   瓷质 效果 ,0,1,1
惊喜 包装 破 碗 质量 颜值 喜欢 ,0,1,1
真不错 裂缝 结实 盖子 合适 好看 ,0,1,1
好看 颜值 高 感觉 不错 炖 东西 不错 ,0,1,0
收到 打开 不错 质量 超好 颜值 高 推荐 推荐 发货 速度 很快 卖家 服务 满意 居家 隔离 厨艺 练起来 ,0,1,1
马克杯 质感 外观设计 好看 手感 舒服 买来 喝咖啡 杯盖 设计 喝咖啡 送 勺子 满意 购物 ,0,1,1
喜欢 回购 盘子 碗 好看 ,0,1,0
杯子 不错 做工 看着 很漂亮 棒棒 ,0,1,1
很漂亮   送 备用 螺丝   螺丝刀   值得 一买 装饰品 好看 ,0,1,0
买来 熬 中药 专用 土罐 太小 不保温 熬 买 ,0,-1,-1
砂锅 收到 货 满意 重量 很足 质量 厚实  熬 稀饭 炖肉 不错 选择 买 东西 信赖 京东 关注 京东 态度 物流 力 昨天下午 下单 今天上午 收到 货 祝 生意兴隆 ,0,0,1
老公 一人 老公 说 高端 大气 貌似 适合 放在 微波炉 加热 颜值 高 推荐 购买 ,0,1,0
不错 好看 铁 陶瓷 厚实,0,1,1
做工 精致 包装 专用 造型 泡沫 全 包裹 送达 不错 容量 常规 药都 ,0,1,1
包装 精致 里外 三层 外观 好看 摸 质感 超爽 手里 感觉 充实 ,0,1,1
好评 杯子 外观 不错 下午茶 时间 ,0,1,0
外观 不错 大小 合适 适合 家用 ,0,1,0
异味 煲汤 煲 糖水 特别 保温 锅 特别 推荐 ,0,0,1
杯子 上档次 做 公司 福利 发放 ,0,1,0
外包装 碗碟 瓷 质量 外观 漂亮 遐思 隔热 效果 ,0,1,1
表面 手感 光滑 手感   美观 程度 很漂亮 ,0,1,1
很快 砂锅 很大 很漂亮 颜色 好看 质地 品牌 值得 信赖 煲汤 煮粥 还会 做 美味 一家 四口 合适 ,0,1,1
价格 实惠 质量 不错 好看 漂亮 包装 满意 破损 ,1,1,1
杯子 好看 容量 不小 挺 满意 ,0,1,0
买 两套 不错 活动 送 几套 我姐 ,1,0,0
质量 差 金鹿 一块 掉 难看 拍照 非说 看不起 差评 ,0,-1,-1
景德镇 旅游 实体店 买 一套 年年有余 美观 爱不释手 小心 磕碎 几个 网店 补 几个 甚 喜欢  ,0,1,0
不错 喜欢 配 勺子 老婆 喜欢 喝水 咖啡 特别 喝咖啡 ,0,1,0
颜色 特别 漂亮 物美价廉 ,1,1,0
买 多套 店家 淡雅 热烈 有种 清雅 脱俗 感觉 盘子 质 手感 光滑 上次 买 另一家 没用 几次 破 真心 手 永久 拥有 ,0,1,1
收到 货 迫不及待 打开 一个碗 很漂亮 质量 挺好 感觉 食欲 大增 ,0,1,1
很漂亮 砂锅 活泼 容量 够 质量 不错 ,0,1,1
东西 不错 样式 希望 耐用 物流 速度 很快 ,0,1,1
包装 挺 结实 泡沫 箱子 ,0,0,1
喜欢 颜值 高 质量 好 拍 照片 美美 哒 ,0,1,1
高端 大气 上档次 低调 奢华 内涵 ￣ ? ￣ 高级 货 ,0,1,0
不错 挺大 昨天 弄个 链接 教 客户 保养 开锅 显得 贴心 有没有 说 玩 ,0,1,0
外观 材质 外观 简洁   干净   材质 不错   挺 满意 ,0,1,1
美观 程度 颜值 高 装饰 效果   大小 尺寸 大小 合适 使用方便 ,0,1,0
色差 ,0,-1,0
包装 产品 质量 不错 ,0,0,1
挺 好看 入手 一套 ,0,1,0
女儿 看中 多家 查看 买家 秀 评价 出手 拿在手上 重感 无色差 质量 杠杠 滴 预想 效果 ,0,1,1
外观 包装 包装 包 特别 严实 损坏   美观 程度 花色 花 漂亮   商品 碗 外形 特别 适合 摞 列 倾斜 歪倒   体验 沈庄 食物 漂亮   瓷质 效果 细腻 光滑 精巧 绝伦   隔热 效果 隔热 效果 推荐 购买 ,0,1,1
尺寸 标准   外观 包装 不错 物流 收到 木有 损坏 ,0,1,1
这套 超级 可爱 喜欢 起司 猫 小碗 破 口 划手 影响 整套 超级 可爱 ,0,1,-1
物流 很快 上午 买 下午 收到 外观 很漂亮 精致 瑕疵 容量 很大 放下 一整只 炖 一锅 鸡汤 一家 四五口 足够 喝 ,0,1,1
釉面 光洁 碗 大小 合适 盘子 口径 深 花色 很漂亮 送货 速度 很快 ,0,1,0
物流 速度 不算   着急 提前 沟通   整体 包装 还算 精美  性价比 挺高   ,1,1,1
砂锅 很漂亮 太 喜欢 煮粥 开锅 第一次 买 砂锅 过年 炖肉 吃 ,0,1,0
看着 不错 好看 后悔 没选 红色 ,0,1,0
项目部 成立 买 品牌 盘子 喜欢 净白 盘子 着色 盘子 没什么 污染 家人 喜欢   美观 程度 漂亮   清洗 难易 清洁   做工 品质 光滑度 高 ,0,1,1
一段时间 评价 确实 不错 配套 勺子 漏碗 实用 锅体 清洁 保温 效果 不错 加热 很快 倒药 把手 有个 气孔 烫 ,0,0,1
锅 错 想 买 小锅 开过 锅 用过 太忙 凑 单买 蛮划算 挺 好看 有空 要试 ,1,1,0
放 一段时间 煮 一锅粥 很快 煮 很软 糯 煲 排骨汤 棒 发现 适合 我家 三口 有个 好处 特别 省 煤气 水开 保温 最小 火 沸腾 状态 满意 煮粥 观察 溢出 粥 浓稠 ,0,0,1
锅 款式 不错 外面 小店 卖 质量 挺好 买来 煲 中药 无奈 药太难 喝 留着 煲汤 物流 很快 推荐 ,0,1,1
担心 破损 收到 货后 打开 一看 挺完整 破损 特别 满意 真 好看 ,0,1,1
买过 品牌 砂锅 小心 熬 中药 干锅 朋友 急躁 关火 破 正好 京东 自营 牌子 活动 价格 双十 算 便宜 没想到 早上 下单 下午 送到 家 打开 瑕疵 工艺 精细 精美 显示 赠品 送 一副 棉 手套 锅 垫子 满意 ,1,1,1
包装 完好 破损 物 流贼 商品 大气 上档次 符合要求 俩 字 劲   配送 手套 垫子 不错 ,0,1,1
喜欢 价格 不贵 选 黑白 系列 超爱 ,1,1,0
外观 包装 外包装 泡沫 箱 特别 号 东西 易碎   商品 商品 挺不错 各有 好处 吃饭 喝汤 盛菜 样样 俱全   体验 东西 特别 关 美观 物美价廉 性价比 特别 高 东西 值得 推荐 放心 购买   瓷质 效果 瓷质 产品 清洗 伤手   隔热 效果 隔热 效果 特别 热汤 热饭 端 在手 里边儿 一点儿 疼   美观 程度 美观大方 图案 特别 可爱 ,1,1,1
收到 货 两次 感觉 不错 大小 合适 款式 颜色 喜欢 ,0,1,0
家 砂锅 坏 正好 赶上 618 做 活动 赶紧 买 一款 产品价格 挺 划算 平时 购买 节省 好多 配送 速度 挺快 第一天 下单 第二天 送到 预计 日期 提前 收到 包裹 打开 完整 完好 破损 ,1,0,1
盘子 大小 合适 价格 实惠 花纹 舒服 ,1,1,1
盘子 容量 简单 色 喜欢 ,0,1,0
外观 漂亮 挺 厚实 挺 喜欢 京东 物流 真心 不像 物流 发个 短信 往门 面上 一放 不管不顾 ,0,1,1
砂锅 不错 容量 红 盖子 黑锅 漂亮 做 砂锅 东西 更周 适合 做 海鲜 粥 皮蛋 瘦肉粥 压机 肉质 食物 保温 挺好,0,1,1
太好了 便宜 ,1,0,0
美观 程度 好看   商品 简约 简单   瓷质 效果 厚 不错   隔热 效果   体验 棒棒   感觉 京东 购物 买 性价比 东西 物超所值 喜欢 买 一套 推荐 妹妹 想 家里 买 一套 推荐 买 ,1,1,1
质量 厚实 砂锅 容量 选择 合适 正 适合 熬 药量 颜色 颜色 黑色 配 熬药 砂锅 性价比 高 ,1,1,1
外观 包装 外形 精美 手感 不错   商品 瑕疵   瓷质 效果 瓷质 细腻   隔热 效果 隔热性 烫手   真心 不错 物流 发 学会 泡沫 箱 暴力 分发 不必要 损失 ,0,1,1
摆饰 价廉物美 高个 公分 赞 ,1,1,0
好大 锅 超过 2.5 L 两个 足够 放电 陶炉 但会 扑 锅 不好 加热 很快 煲 汤 一个半 小时 价格 性价比 高 可爱 爱 ,1,1,1
砂锅 买来 煲 粥 做 砂锅 饭 适合 做饭 质量 不错 推荐 ,0,0,1
外观 包装 包装 细心   美观 程度 颜值 高   商品 瓷器 细腻 做工 ,0,1,1
晚上 下单 中午 打开 包装 二天 大小 合适 美观 结实 耐用 ,0,1,1
这家 店 买 东西 感觉 质量 不错 收到 迫不及待 拆 包装 陶瓷 精美 喜欢 买来 试一试 太爽了 晚上 沉浸 爽 之中 ,0,1,1
包装 完好 无破损 商品 满意 ,0,0,1
东西 收到 颜色 很漂亮 喜欢 物流 力 希望 东西 ,0,1,0
美观 程度   花型 设计   清洗 难易 易   做工 品质   瓷质 效果   美观 程度 ,0,1,1
这套 陶瓷 餐盘 不错 厚薄 合适 太 笨重 太 轻薄 大小 适合 家用 釉质 细腻 买 家里 差 几个 买 一套 够用 价格 实惠 同等 质量 超市 便宜 满意 ,1,1,1
收到 时 包装 完整 盘子 之间 一层 防摩损 不知 东西 软 皮质 手感 细腻 盘子 好看 白得 赏心悦目 深度 挺能 装 ,0,1,1
箱买 电 担心 熬 不好 选择 这款 锅 不错 大小 合适 熬 中药 特别 耐热 煮 放会 量 挺 满意 ,0,1,1
砂锅 一段时间 孩子 炖汤 不错 厚实 锅 冬天 喝汤 挺 京东 速度 很快 包装 ,0,0,1
样子 个性 水瓶座 喜欢 贴心 礼物 好评 ,0,1,0
超棒 当摆饰 好看 ,0,1,0
好看 杯子 包装 严实 完整 异味 不错 ,0,1,1
美观 程度 怀旧感 十足   表面 手感 光滑   外观设计 感觉 盖 滑动 太 稍微 晃动 小点 ,0,1,1
手感 光滑 物流 很快 值得 购买 ,0,0,1
货已 收到 质量 不错 物流 包装 ,0,0,1
外观设计 挺 喜欢 简单 设计 好看 ,0,1,0
盘子 碗 图案 特别 可爱 图片 质量 特别 好 杂志 女票 说 看着 乖 碗饭 吃 点 ,0,1,1
几天 送 锅盖 小帽子 塑料 材质 一点 烫手 过用 几天 发现 好用 裂纹 质量 推荐 发货 两天 收到 谱 ,0,0,1
碟子 实物     预期     裂缝 毛边     ,0,0,-1
确实 划算 素净 颜值 不错 ,1,1,0
包装 用心 泡沫 箱子 外面 缠 胶带 破损 情况 产品 说 质量 不错 花色 图案 高端 大气 上档次 赶上 京东 活动 实惠 ,1,1,1
几天 天气 正好 穿 款式 新颖 黑色 先 大气 满意 ,0,1,0
拿到 迫不及待 想 锅 拆开 发现 包裹 严实 关键 锅 很大 结实 内壁 厚 三到 五个 份量 小熊 品牌 东西 失望 回购 ,0,1,1
砂锅 三个 吃饭 足 足够 保温 效果 锅 节约 时间 味道 外形 很漂亮 ,0,1,1
苏泊尔 砂锅 厚实 质量 煮粥 煮汤 不错 样子 好看 大小 合适 买 ,0,1,1
小碗 不错 喜欢 两个 大小 够用 ,0,1,0
喜欢 可爱 砂锅 挺大 煲 真不错 太棒了 ,0,1,0
砂锅 颜值 高 把手 盖 烫手 设计 保温 盖子 橡胶套 顶部 烫 设计 贴心 ,0,1,1
外观 很酷 很漂亮 耀眼 黑 上档次 喜欢 ,0,1,0
商品 品质 买 一套 补 几个 碗 质量 不错 ,0,0,1
包装 保护 到位 收件 验货 破损 厂家 值得 点赞 盘子 花纹 经久 耐看 设计 朴素大方 送 筷子 汤匙 性价比 超高 送货 购物 体验 ,1,1,1
包装 打开 包装 碗碟 完好 干净 无损 碗碟 花样 好看 做工 精细 小哥 认真负责 送货上门 送货 速度 ,0,1,1
用碗 喝水 桌面上 瞬间 高大 嘿嘿嘿 ,0,1,0
砂锅 很漂亮 收到 洗 干净 烧 羊肉 味道 很巴适 ,0,1,0
商品 外观 可爱 买家 服务态度 值得 购买 ,0,1,0
外观 包装 泡沫 包装 轻便 完好 内腔 专 碗碟 设置 易于 运输   美观 程度 美观大方   商品 质优 实惠   体验 满意   瓷质 效果 光滑 杂点   隔热 效果 ,1,1,1
手工 工艺 评价 说 厚 杯盖 好像 杯 身不太 贴合 一般般 ,0,0,-1
"折买 , 价格 , 真 便宜 , 东西 , 很漂亮 , 原 价格 买 亏 ",1,1,0
感觉 手感 不错 店家 贴心 送 杯 垫 开心 ∩ ∩ ,0,0,1
京东 品质 保障 服务 速度 ,0,0,1
制作 材料 特别 实在 厚实 导热 容量 3500ml 煲汤 够 全家人 喝 颜值 全 黑色 外边 有花 装饰 送 手套 垫子 价格 还好 性价比 高 ,1,1,1
一如既往 支持 实惠 下次 朋友 买 喜欢 网购 好看 喜欢 新款 关注 ,1,1,0
这家 陶瓷 真是太 好用 第一次 想 收到 货后 开心 陶瓷 质量 品质 愉快 购物 ,0,0,1
外观 包装 包装 泡沫 箱 包装 破   美观 程度 东西 感觉 挺值 自用 盘子 碗 够用 汤碗 汤勺   体验 清洗 表面 光滑 质量 不错 好用 ,1,1,1
包装 漂亮 京造 质量 不错 ,0,1,1
图案 有毒 反正 喜欢 地方 买 两次 搞 活动 价格 美丽 买 一套 介绍 两个 朋友 买 喜欢 做工 精致 NICE ,1,1,1
精致 搞 活动 买 划算 漂亮 盘子 做饭 兴趣 ,1,1,1
包装 防碎 设计 新颖   美观 程度 很棒   外观设计 优雅 ,0,1,1
这套 四叶草 碗碟 确实 很漂亮 清淡 素雅 家人 喜欢 家里 主打 碗 具 商品 建议 买 建议 混装 版 两个 舒服 ,0,1,0
做工 精细 材质 中等 不轻不重 感觉 还行 推荐 速度 特别 爱 爱 感觉 实物 图片 更好 价格 质量 成正比 购物 满意 喜欢 宝宝 赶紧 下手 宝贝 物超所值 好看 下次 还会来 ,1,1,1
用过 一段时间 评价 东西 确实 不错 煲汤 菜市场 买 砂煲 丑丑 说 非常容易 坏 这款 砂煲 很漂亮 造型 大方 使用方便 容量 一家 四口 绰绰有余 炖 几次 味道 砂煲 光洁 细腻 如新 喜欢 ,0,1,1
买来 送人 想 不行 有没有 破损 劣质,0,0,-1
商品 不错 光滑 瑕疵 颜值 高 犹豫 砂锅 把手 端 打滑 买 成 那种 环状 把手 收到 令人 惊喜 砂锅 把手 底部 做 凹槽 端 舒适 ,0,1,1
不错 物美价廉 性价比 超高 坏 几个 勺子 碟子 老板 补发 超级 神速 值得 回购 ,1,1,1
惊喜 收到 货 打开 看时 惊喜 外形 优雅 大方 耐看 色泽 均匀 碗 温白 碗 外 黝黑 搭配 高大 瓷质 厚实 质地 温和 釉面 匀净 原以为 很大 刚刚 中式 容积 碗款 矮 吃 米饭 刚刚 包装 到位 满意 ,0,1,1
好看 日式 风格 喜欢 盘子 包装 ,0,1,0
杯子 收到     包装 严实 完整 实物 图片 想象 中 ,0,0,1
宝贝 到货     外观 包装 包装 严实   美观 程度 时尚 大气   体验 特别 好用 ,0,1,1
发货 很快 包装 完好 杯子 质量 结实 勺子 杯子 小象 图案 可爱 杯 口径 够 清洗 买 杯子 水 喝 ,0,1,1
包装 颜值 不错 质量 厚实 ,0,1,1
喜欢 亲们 下手 实惠 购物 质量 赞 物所值 值得 一购 实惠 大爱 ,1,0,1
砂锅 外形 好看 材质 砂锅 摸 光滑 多余 杂质 价格 优惠 大小 合适 ,1,1,1
买来 赠送给 弟弟 乔迁之喜 实物 好看 信任 佳佰 品牌 购物车 好久 双 十二 降价 果断 买 ,1,1,0
昨天 下单 颜值 高 爱 洗 几遍 汤 炖上 没炖 看着 不错   门口 药店 买 黄芪 党参 红枣 枸杞 黄豆 汤 好喝 ,0,1,0
物流 很快 包装 不错 看着 高大 上档次 做工 彩釉 满意 ,0,1,1
收到 大小 合适 表面 光滑 ,0,1,1
收到 京东 物流 周五 上班 不好 接电话 星期六 送 还切 开箱 验货 确保 瓷器 完好 收到 货后 确实 太 好看 盘子 深度 平时 家里 买 高 好看 实用 家里 鱼盘 配对 ,0,1,1
杯子 很漂亮 喜欢 物美价廉 值得 购买 ,1,1,0
精致 一款 产品   美观 程度 外观 外观 漂亮   瓷质 效果 效果 亮眼   瓷质 品质 感觉 不错 ,0,1,1
不错 一款 砂锅 煮 砂锅 饭 吃货 收到 欣喜若狂 外观 颜色 好看 设计 不错 做工 精细 好评 三个 份量 足够 期待 美食 烹饪 京东 物流 蛮快 谢谢 员 风雨 中 陪伴 ,0,1,1
宝贝 收到 厚实 外观 漂亮 估计 每次 炖 一只 ,0,1,1
手感 不错 超市 便宜 超值 ,1,0,1
漂亮 碗 每顿 吃饭 ,0,1,0
厚实 保护 做 不错 ,0,0,1
描述 出乎意料 物美价廉 精致 漂亮 满意 ,1,1,1
这锅 真不错 太爱 漂亮 不大不小 底部 瑕疵 一般 ,0,1,-1
总体 感觉 很值 不贵 摆件 高档 ,1,1,0
砂锅 性价比 高 表面 光滑 份量 喜欢 砂锅 大小 适中 回来 煮 粥 很香 店家 发货 速度 很快 包装 磕磕碰碰 失望 推荐 ,1,1,1
碗 很棒 太美 喜欢 物流 不给力 ,0,1,0
好用 非常适合 家里 摆放 物件 打算 拿来 放 肥皂 挺 好看 好好 强烈推荐 ,0,1,1
不错 不错 送 螺丝刀 安装 质感 不错 味道 好评 ,0,0,1
颜色 漂亮 质量 喜欢 款 很深 足够 一家 四口 煮粥 煲汤 保温 性强 骨头 易煮化 大小 合适 ,0,1,1
砂锅 喜欢 我家 四个 大人 小孩 正合适 炖 两次 猪脚 汤 浓肉 粑 家里人 夸 买 特 保温 冬季 适合 ,0,1,1
容量 够 ,0,1,0
价格 超 优惠 棒 完美 购物 ,1,0,0
高压锅 不锈钢 锅 煮 不出 味儿 小火 慢慢 炖 中途 不用 加水 隔热 保温 炖排骨 红烧 鸡爪 炖 养胃 粥 太好 京东 物流 当天 买 第二天 送 购物 体验 同城 跑腿 京东 物流 炖排骨 放 玉米 楼下 广东菜 汤 棒 ,0,0,1
汤煲 收到 大爱 质量 超级 颜值 高 斑马 清新 可爱 做工 细腻 瑕疵 大容量 看着 能炖 整只 下次 还来 这家 ,0,1,1
外观 包装 包装 精致   美观 程度 好看 吖   商品 厚实 良品   厚实 感   体验 不错   瓷质 效果 花纹 釉质 色素   整体 体验 不错 哈哈哈 外卖 好吃 只能 煮 好吃 ,0,1,1
外观 包装 外观 包装 漂亮 结实 眼前一亮 看着 上档次 打开 包装 一点 磕碰 一层 隔开 没有磨损 瓷质 质感 淡淡的 乳白 淡雅 金色 花纹 赏心悦目 满意 隔热 效果 烫手 一整套 美观 实用 ,0,1,1
碗 很漂亮 买 两套 两种 花纹 很漂亮 实用 价格 实惠 下次 ,1,1,1
货收 完好无损 图片 美观 外包装 完好 物流 ,0,1,1
漂亮 描述 相 ,0,1,0
包装 严实 产品 精致 美观 关键 价格 实惠 物超所值 送 迷你 工具 贴心 ,1,1,1
包装 特别 保护 脆弱 砂锅 一丝 磕碰 收到 货物 通体 光滑 毛刺 做工 精致 表面 印着 俏皮 斑马 砂锅 显得 俏皮 可爱 大小 合适 正好 三口 家 锅 深 特别 初学者 汤 溢出 锅外 ,0,1,1
满意 购物 砂锅 质量 摸 质感 买来 老爸 煎 中药 喝 煎 药味 很浓 药 成分 保留 值得 推荐 ,0,0,1
造型 简单 大方 喜欢 太 装饰 盘子 大小 合适 深度 汤汁 洒 价格 不贵 满意 ,1,1,0
很漂亮 煲汤 煮粥 足够 吃 味道 不错 ,0,1,0
很漂亮 杯子 买来 混合 麦片 吃 颜值 爱 红色 放在 桌子 眼前一亮 釉色 均匀 细腻 做工 不错 带个 勺子 冲调 饮品 杯盖 勺子 设计 缺口 放入 勺子 杯盖 盖 尴尬 杯盖 一圈 凸起 能卡 杯口 掉落 ,0,1,1
宝贝 收到 惊喜 设计 时尚 大方 关注 回购 碗 不错 便宜 哈哈哈 ˊ ˋ ,1,1,0
外观 包装 大气   美观 程度 完美无瑕   商品 小巧玲珑   体验 经济 实惠   瓷质 效果 光滑 细腻   隔热 效果 非常适合 ,1,1,1
外观 包装 装 整齐 完美   美观 程度 美观大方   商品 线条 流畅 设计 现代感   体验 效果 不错   瓷质 效果 瓷质 丝滑 精美   隔热 效果 隔热 效果 总体 满意 ,0,1,1
砂锅 质量 不错 容量 很大 预想 好多 第一 选错 型号 店家 发错 货 确认 发现 没错 京东 速度 很快 ,0,1,1
容量 大且 好看   质量 挺好,0,1,1
包装 完好无损     釉面 平整   烧制   轻微 瑕疵 影响   好评 ,0,0,1
精致 美观 喜欢 购买 小伙伴 值得 购买 ,0,1,1
满意 第二次 卖货 上次 选 升 感觉 尺寸 买 5.5 升 够用 ,0,1,0
买 盘子 配成 一套 哈哈哈 太棒了   外观 包装 完好无损   美观 程度 很漂亮   吃 面用   商品 花纹 好看   体验 很棒   瓷质 效果     隔热 效果   烫 ,0,1,1
砂锅 挺 好多天 开锅 要开 最小 火 溢出 食物 保温 粘锅 粘锅 清洗 干净 满意 谢谢 ,0,0,1
不错 用料 做工 倒 满水 感觉 两根 手指 稍重 杯身 把手 厚实 性价比 高 活动 赶紧 买 平时 泡点 咖啡 豆奶 茶 ,1,0,1
买来 喝汤 感觉 质量 物流 给力 活动 性价比 高 ,1,0,1
杯子 不错 质感 挺好 容量 大小 刚刚 送 小勺 ,0,1,1
东西 棒 质量 特别 物美价廉 炖肉 熬 稀饭 味道 美美 ,1,1,1
不错 质量 不错 ,0,0,1
行 美观大方 实用 有个 汤勺 完美 ,0,1,1
开箱 一看 惊喜 容量 很大 质量 特别 手 摸上去 特别 顺滑 晚上 ,0,1,1
杯子 看着 不错 质量 好 物美价廉 ,1,1,1
价廉物美 很漂亮 碗 盘子 收到 换 新 京东 购物 超 ,1,1,0
时期 京东 物流 谱 很快 送到 包装 完好 锅 样子 质量 赠送 防 烫手 套 垫片 ,0,0,1
好看 盘子 喜欢 样子 ,0,1,0
杯子 收到 很漂亮 颜色 好看 ,0,1,0
买 买 不买 亏了   便宜 美呆 质量 特 厚实 图案 店家 包装 特别 用心 保鲜膜 固定 破损 ,1,1,1
不错 值得 购买 够 高大 ,0,1,0
很漂亮 图片 喜欢 师傅 态度 特别 ,0,1,0
收到 包装 外观 漂亮 高品质 量 买 想 买 放心 购买 ,0,1,1
烟灰缸   抽烟   朋友   颜值 高 满意   装配 工具 挺 齐全   美观 程度 大气 简约 美观 ,0,1,0
愉快 购物 包装   外观 包装 防护 到位   美观 程度 做工 精细   瓷质 效果 效果 不错 ,0,1,1
喜欢 好看 物流 很快 购物 体验 愉快 选择 几家 细瓷 白瓷 做工 细腻 一家 京东 自营 果断 下单 两件 入手 ,0,1,1
