文本,价格,外观,质量
外观 包装 结实   美观 程度 特 好看 喜欢 说好   商品 正好 两个 需求 够用   体验 挺 瑕疵 盘子 好看   瓷质 效果 挺 一点 瑕疵   隔热 效果 挺 烫手 ,0,1,1
说 超级 锅 hahahaha 尺寸 买 两个 人用 超级 质量 阔以 ,0,1,1
行 第一次 筷子 就断 一根 轻轻 就断 ,0,0,-1
杯子 不错 值得 购买 整体 好看 简单 颜色 搭配 很赞 喜欢 ,0,1,0
大小 合适 颜 高 升温快 炖汤 煮粥 熬粥 炖鸡 熟 多面手 家里 挺 ,0,1,1
煲汤 砂锅 厚实 颜色 好看 大气 上档次 煲 汤 香 美味 ,0,1,1
好用 上火 黑色 好看 加热 算快 保温 ,0,1,1
质量 买   特别 光滑   瑕疵 ,0,0,1
发货 很快 包装 泡沫 包装 收到 货 完好无损 喜欢 款 图案 质量   厚实 寸 盘子 大小 正好 盘子 很深 能装 汤 撒 物美价廉 ,1,1,1
碗 特别 好看 大小 合适 买 几次 确实 值得 购买 ,0,1,0
盘子 喜欢 白色 清爽 ,0,1,0
挺 好看 ,0,1,0
小锅 仔 尺寸 适合 冬天 焖 烧 保温 造型 可爱 使用方便 适合 量 喜欢 款 产品 我家 餐桌 主角 ,0,1,1
很漂亮 烟灰 盅 款式 好看 颜色 漂亮 满意 价格 优惠 减了 优惠券 0.01 ,1,1,0
瓷器 做工 精细 花纹 漂亮 感觉 上档次 家人 喜欢 值得 购买 推荐 ,0,1,1
挺 杯子 外形 美观大方 喝咖啡 刚刚 全新 拆开 不错 ,0,1,0
罐 难看 岩上 划痕 ,0,-1,-1
惊喜 瑕疵 实则 品相 完好 精美 精致 ,0,1,1
碗 很漂亮 气质 生活 节奏   一个碗 一点点 瑕疵 退款   谢谢 下次 还会 光顾 ,0,1,-1
包装 完美 担心 运输 磕 情况 关键 京东 自营 配送 速度 杠杠 滴 上午 订单 下午 送到 信赖 京东 喜欢 京东 服务 3.5 升 容量 太大 买 小点 容量 够 吃 ,0,1,1
碗 做工 精致 可爱 喜欢 磕碰 满意 ,0,1,1
发 包装 特别 严实 领了 张券 买 划算 ,1,0,1
家里 碗碟 套餐 具挺 好看 抵不住 诱惑 正好 碰上 搞 活动 划算 赶紧 买回来 试试 一个碗 破 一点点 反馈  ,1,1,-1
产品 不错 值得 推荐 信任 品牌 朋友 推荐 买回来 外观 不错 用料 期待 时 效果 再来 追评 厚实 ,0,1,1
外观 很漂亮   外观 包装 泡沫 箱装 到手 碎   美观 程度 白色 好看 烧制 均匀 颜色 统一 遐思 ,0,1,1
宝贝儿 包装 严实 外观 精致 漂亮 手感 光滑 细腻 颜色 图片 一模一样 厚实 质量 不错 送货 速度 员 态度 满意 ,0,1,1
材质 做工 不错 花色 好看 包装 严实 破损 满意 ,0,1,1
外观 包装 包装 严实 正规   美观 程度 好看 大小 合适   体验 顺手 质感 ,0,1,1
质量 适合 外观 特色 颜色 搭配 年轻 ,0,1,1
东西 质量 精致 ,0,0,1
真 特 漂亮 质量 特 满意 ,0,1,1
包装 力 泡沫 包 严实 生怕 回来 后碎 想 杯子 整体 手感 光滑,0,0,1
小巧 可爱 质量 适合 做菜 活动 便宜 干烧 保温 喜欢 砂锅 划算 小熊 忠实 粉丝 不错 ,1,1,1
陶瓷 煲 ASD 品牌 质量 棒 家里 高压锅 牌子 煲 鸡汤 牛腩 很香 挺 做饭 帮手 煲 体大 四五 量 煲 美观 电饭煲 做 口感 先大 火烧 开 文火 慢炖 不用 太多 技巧 即可 轻松 硬菜 汤 粥 烹饪 ,0,1,1
实物 绝美 熬出来 粥 孩子 喜欢 棒 ,0,1,0
不错 质量 赠品 到货 真 型号 不小 太大 好看 包装 严实 坚固 坏掉 煲 中药 不错 值得 推荐 ,0,1,1
做饭 锅 烧糊 搞 活动 买 质量 做工 一点 瑕疵 污渍 包装 结实 无限 回购 ,1,0,1
美观 程度 漂亮 挺深 对心 ,0,1,0
满意 好看 景德镇 瓷器 ,0,1,0
力时 一个月 包裹 终于 样式 美观 做工 精致,0,1,1
外观 包装 包装 稳重   美观 程度 美观大方   商品 简约 适度   体验 好用   瓷质 效果 美 坚固   隔热 效果 好用 ,0,1,1
便宜 好用 不错 不错 京东 买 划算 第一天 买 第二天 物流 速度 很快 正好 急用 锅 质量 价钱 不贵 ,1,0,1
第二次 买 盘子 真不错 超值 价格 合适 发货 速度 很快 辛苦 哥 ,1,0,0
特别 喜欢 小熊 家 产品 蒸蛋 器是 小熊 保温杯 颜值 高质量 邻居 买 小熊 家 电饭煲 ,0,1,1
差评 做工 粗糙 划手,0,0,-1
东西 收到 物流 速度 很快 可爱 喜欢 ,0,1,0
小熊 忠实 粉 东西 可爱 3.5 L 超级 砂锅 想象 中 一整 大小 但炖 汤 够 一家 三口 物流 包装 结实 一点 不用 担心 运输 撞坏 ,0,1,1
美观 程度 好看 漂亮 买 ,0,1,0
大小 一家 款式 好看 真是太 喜欢 ,0,1,0
包装 严实 可靠 定型 泡沫 专用 纸箱 确保 煲 具 运送 外观 好看 光滑 细腻 易于 清洁 店家 送 滤斗 小勺 硅胶套 实用 ,0,1,1
质量 不丑 好看 值得 购买 ,0,1,1
送到 包装 完好 京东 小哥 业界 优秀 锅 两块 泡沫 包裹 拆 泡沫 很难 拆开 用力 一下子 锅飞 选择 放在 床上 拆 放心大胆 拆 我用 炖 一锅 排骨汤 美味 先煮 一锅 稀饭 养锅 煮 完 稀饭 倒 炖 厚实 保温 价格 合适 高级 感 ,1,1,1
砂锅 斑马 可爱 终于 熬汤 大计 砂锅 容量 熬 满满 一锅 估计 喝完 日常 两人份 足够 运输 质量 包装 破损 京东 值得称赞 不错 不错 ,0,1,1
行 价格 合适,1,0,0
超级 棒 砂锅 厚实 一家 四口 ,0,0,1
入手 沉 外观 漂亮 圆润 赞 ,0,1,1
质量 评价 担心 瑕疵 碗 完美 早 多买 几只 下单 时 无货 遗憾 下次 颜色 犹豫 很久 买 黑色 收到 实物 甚 惊喜 深灰色 不到 黑色 程度 深灰 漂亮 超级 喜欢 ,0,1,1
饭碗 爆开   美观 程度 很漂亮   外观 包装 行 ,0,1,0
锅 质量 特别   颜色 好看 陶瓷 特别 小心   摔坏   磕碰   京东 重 失望 ,0,1,1
这颜值 爱拉爱拉 家里 酸奶机 绞肉机 煮蛋 器 小熊 颜值 高质量 砂锅 选 小熊 太 喜欢 3.5 升 够 买个 同款 小号 买 东西 京东 自营 给力 ,0,1,1
盘子 大小 合适 厚度 适中 纯白 很漂亮 未 发现 瑕疵 ,0,1,1
美观 程度 挺 好看   商品 便宜   外观 包装 包装 ,1,1,0
大小 合适 舒适 人性化 设计 盖子 更易 保温 厚实 包装 超 仔细 用心 做 产品 ,0,1,1
物流 很快 包装 破碎 买 4L 熬 中药 第一次 火候 喷水 沉 隔热 导热 很快 借用 湿 抹布 刚用 周 ,0,0,1
简约 大方 漏送   很快 解决   筷子 略显 粗糙   ,0,1,-1
京东 购物 体验 物美价廉 送货到 门 实惠 这款 汤煲 家 味道 之选 价格合理 买 感觉 物超所值 ,1,1,0
外观 包装 泡沫 箱 包装 破损   美观 程度 美观大方   商品 厚实 清爽 耐看   体验 厚实 顺手   隔热 效果 超级 棒 烫手 ,0,1,1
盘子 质量 物流 很快 昨天 下单 第二天 包装 到位 损坏 满意 下次 回购 谢谢 店家 优质服务 ,0,0,1
款 碗碟 两次 质量 不错 光滑 颜色 好看 满意 ,0,1,1
碗 收到 完整 光滑 实惠 挺 满意 好评 追评 ,1,0,1
一套 组合 房屋 精美 家具 摆设 ,0,1,0
赞赞赞 值得 购买 物美价廉 质量 不错 ,1,1,1
工艺 品质 物美价廉 喜欢 唯一 一个月 收到 货 ,1,1,1
超级 喜欢 款 砂锅   外观 小巧 可爱   大小 适合 ,0,1,0
美观 程度 外观 精致   表面 手感 感觉 细腻   实用 效果 实用性 强 ,0,1,1
大肚 锅 挺 可爱 家里人 煲汤 不错 整体 质量 感觉 惊喜 价位 不错 期待 效果 ,1,1,1
感觉 盖子 坏 补发 退货 时 找到 ,0,0,-1
搬新家 家里 添置 高大 碗碟 收到 货 第一 时间 打开 失望 太 好看 喜欢 ,0,1,0
挺 好看 做 活动 买 感觉 超值 ,1,1,0
外观 包装 不错   美观 程度 素雅   体验 还好 ,0,1,0
过得 容量 很大 够 口人 喝汤 东西 满意哦 美观 时尚 大气 超级 耐心 服务 细致 贴心 品牌 ,0,1,0
配色 高级 挺 高级 感 放在 桌子 艺术品 物美价廉 ,1,1,0
瓷 细腻 超出 预期 包装 两天 ,0,0,1
商品 外观 光滑 做工 细致 用料 讲究 颜色 超正 容量 煲汤 水滚 汤 外溢 保温 时间 长 煲 汤水 好喝 ,0,1,1
物超所值 喜欢 包装 完美 好看 细节 精致 安装 配件 考虑周到 安装 优秀 光临 ,1,1,1
印象 中 质感 值得 购买 ,0,0,1
砂锅 很棒 牌子 京东 自营 店 砂锅 质量 超出 想象 体积 很大 支持 京东 自营 店 ,0,1,1
放假 在家 太闲 想 做做 吃 发现 缺少 一只 煲 多方 火速 下单 京东 效率 从没 失望 包装 完好 打开 更是 惊艳 红色 很正 釉面 亮 光滑 煲体 厚实 做 几次 汤 羹 满意 希望 好用 别炸 ,0,1,1
漂亮 质量 杠杠 滴 下次 还会 回购 ,0,1,1
砂锅 大小 合适 家庭 足够 包装   送货上门 颜色 好看 锅体 顺滑 砂锅 做 砂锅 粉丝 煮面 炖鸡汤 特别 满意 ,0,1,1
盘子 运送 小哥 运送 过程 中 破碎 完整 精致 ,0,0,1
终于 实物 奈斯 绝美,0,1,0
我天 到手 五分钟 盖子 阵亡 挑   盖子 太松 直着 还好 斜 掉 开花 ,0,-1,-1
价格 太 实惠 包装 扎实 破损 做工 算 精细 特别 及时处理 确实 满意 网购 还会 ,1,0,1
产品 超级 棒 下次 还会 买 愿 越做越 精致 购物 体验 ,0,0,1
盘子 第二次 买 拿到 手 盘子 碎  ,0,0,-1
特别 喜欢 砂锅 买回来 炖汤 熬粥 容量 特别 适合 一家 五口 吃饭 超级 实用 质量 特别 炖汤 砂锅 味道 ,0,1,1
速度 很快 哥 服务态度 砂锅 挺棒 保温,0,0,1
外观 包装 包装 上档次 特价 一下子 买 两套 刚觉 还行 ,1,1,0
超级 超级 喜欢 盘子 那种 深 盘子 碗   外观 好看 瓷质 一共 件 四个 盘子 四个 碗 四双 筷子   四个 瓷 勺子 ,0,1,1
"到时候 大小 质量 颜色 干净 , 光滑 瑕疵 特别 满意 ",0,1,1
一个多月 评价 品牌 值得 信赖 熬粥 煲汤 炖排骨 极好 容量 罐子 适合 一家 四口 人用 很赞 赞赞 罐子 材质 细腻 陪上 红色 盖子 显得 更好 摆在 燃气灶 赏心悦目 忍不住 ,0,1,1
打开 包装 漂亮 做工 精致 高端 大气 上档次 家里 客人 满意 购物 ,0,1,1
美观 程度 杯子 太 好看 很亮 图案 喜欢   外观设计 图案 喜欢 喜欢 好久 下手 图画 特别 鬼马 包装 几层 包裹 点赞   手工 工艺 做工 精致 轻重 正好 随便 一放 好看 大牌 性价比 不错 放心 ,1,1,1
购买 平台 质量 不错 特别 品牌 值得 信赖 品质 一级 棒 包装 不错 物流 很快 价格合理 实惠 美观 东西 质量 速度 力 质量 态度 赞 解决 ,1,1,1
挺 色彩 漂亮 做工 精细 包装 精美 破损 用心 老板 祝 生意兴隆 ,0,1,1
东西 签收 质量   不错 便宜 实惠   美观 愉快 购物 下次 需要的话 还会 购买 看着 挺 精致 追评 ,1,1,1
特意 回家 一段时间 写 评价 不错 两个 吃 这锅 稍稍 天 陆续 试 排骨汤 汤类 砂锅 红烧 猪蹄 汤清肉 香 软烂 好吃 太 好看 精美 最具 利用率 锅 锅子 密封 导热 不错 满意 ,0,1,1
盘子 不错 纯白色 特别 美 大小 合适 ,0,1,0
不错 花纹 精致,0,1,1
质量 价格 便宜 炖 一只 鸽子 大小 ,1,0,1
实用 一套 绝美 性价比 超高 ,1,1,1
满意 物有所值 ,1,0,0
美观 程度 印花 大众   外观设计 盖子 人性化   实用 效果 不错 地盘 磨损   特色 结实 确实 结实 摔 次 没事 送个 不错 勺子 ,0,1,1
物流 速度 东西 厚实 赞 ,0,0,1
包装 颜色 图片 好看 质量 够 一家 口用 足用 设计 厚实 耐用 喜欢 赶紧 买 实惠 划算 ,1,1,1
第二次 购买 质量 容量 很大 放 外观 精致 漂亮 摆在 厨房 靓丽 一条 风景线 京东 物流 很快 商品 损坏 ,0,1,1
质量 不错 喜欢 碗碟 分量 大小 合适 ,0,1,1
泡沫 保护 到位 碗碟 碎 ,0,0,1
包装 破损 碗面 干净 质量 色差 表面 光滑 配置 超市 划算 送货上门 ,1,1,1
宝贝 收到 超级 喜欢 颜值 高 实用 超级 喜欢 ,0,1,1
想 妈妈 买 陶瓷 炖锅 活动 品牌 信任 回来 妈妈 满意 ,1,0,0
买 两位 小朋友 大小 合适 精致 小巧 做工 ,0,1,1
很大 实用 鱼 爱 爱 ,0,1,1
衣服 收到 纯棉 面料 舒服 精致 上身 效果 特别 款式 很漂亮 满意 ,0,1,1
碗 套装 很漂亮 质量 一囗气 买 三套 包装 速度 性价比 高 朋友 入手 怀疑 ,1,1,1
杯子 外观 好美 质量 京东 物流 很快 昨天 下单 收到 ,0,1,1
完好无损 京东 小哥 超级 ,0,0,1
外 包装箱 完好 商品 破损 好看 还会 推荐 朋友 ,0,1,1
锅 厚实 可爱 受热 质感 两到 四个 吃 喜欢 ,0,1,1
杯子 光滑 细腻 颜色 很漂亮 很快 服务 ,0,1,1
质量 光滑 图案 好看 ,0,1,1
很小 很小 怨 怨 ,0,-1,0
心仪已久 砂锅 终于 买 好多 牌子 砂锅 最终 买 这款 下单 第二天 迫不及待 打开 不错 包装 严实 颜色 适合 过年 清洗 干净 下午 煲汤 煲 汤 电压 锅 汤要 香 好喝 棒 ,0,1,1
餐盘 很漂亮 颜色 亮丽 质量 不错 光亮 喜欢 买 二套 推荐 朋友 购买 态度 商品 包装 点赞 ,0,1,1
买 盘子 物美价廉 外观 简单 大方 性价比 高 陶瓷 盘子 装菜 好处 美观 大气 干净 卫生 热 传递 性能 强 端菜 时 不易 烫 到手 表面 光滑 清洗 ,1,1,1
款 产品 质优价廉 款式 好看 容量 挺大 放 一整只 足够 强大 京东 自营 排行榜 推荐 购买 确实 不错 做工 精致 重量 足 运输 很快 达 包装 严实 完好 未损 用券 优惠 便宜 ,1,1,1
期待 很久 收到 外观 包装 结实 保证 运输 过程 中 磕碰 盘子 深 碗 容量 不小 够用 手中 厚实 外观 很漂亮 ,0,1,1
满意 想 买 两个 大碗 质量 厚实 花 一分钱 超赞 ,1,0,1
发货 速度 很快 东西 包装 满意 到货 迫不及待 打开 失望 质量 特别 正品 价格便宜 性价比 超高 特别 划算 值得 购买 ,1,0,1
美观 程度 杯子 精致 颜值 高 价格 实惠 块 物流 力 晚上 下单 隔天 早上 收到   表面 手感 手感 颜色 喜欢 杯子 异味 瑕疵   收到 泡 黑豆 粉喝 满意 ,1,1,1
买 送 朋友 漂亮 朋友 喜欢 ,0,1,0
想象 中 好看 摸 舒服 ,0,1,1
精致 烟灰缸 特别 上档次 喜欢 ,0,1,1
美观 程度 色泽 很棒   外观设计 设计 超级   手工 工艺 做工 细致   实用 效果 使用方便   关键 价格合理 ,1,1,1
中途 插曲 实在 太 周到 完美 解决 颜值 高 质感 不错 喜欢 ,0,1,1
想象 中 不错 质量 瑕疵 棒 ,0,0,1
包装 保护 完整 外观 颜值 高 ,0,1,1
不错 高大 时尚 空间 很大 泡 咖啡 奶茶 不错 ,0,1,0
大小 正合适 两三个 人用 人口 弄 一道 菜放 桌子 正好 试用 不错 价格 不贵 小熊 东西 买 感觉 质量 保障 ,1,1,1
漂亮 实用 咖啡杯 质地 优良 京东 物流 太棒了 晚上 下单 次日 中午 收货 很赞 ,0,1,1
第一回 碰到 用心 卖家 实惠 购物 宝贝 很行 发货 速度 神速 第一次 下手 说 实惠 时间 来评 ,1,0,0
烟灰缸 收到 漂亮  ,0,1,0
调理 身体 买 熬药 砂锅 收到 砂锅 那一刻 感觉 太 惊喜 厚实 造型 漂亮 中药 特意 买 号 倒药 毛巾 蘸湿 包裹 手上 烫 ,0,1,1
太棒了 漂亮 还好 买 4.6 正好 不大不小 爱仕达 漂亮 想 买 差错 炖 ,0,1,0
砂锅 不错 表面 光滑 细腻 易清洗 干净 大小 合适 颜色 很漂亮 ,0,1,1
好看 好看 好看 手里 感觉 厚实 特别 质感 放 桌上 摆件 当放 零碎 东西 不错 时 推荐 同事 朋友 ,0,1,1
大小 泡刚 买 新茶 外观 好看 喜欢 ,0,1,0
惊艳 物美价廉 祝 老板 生意兴隆 ,1,1,0
突发奇想 想 买 几个 mugs 网上 找 款式 丰富多彩 杯子 矮矮的 好处 盖子 还配 不锈钢 勺子 喝咖啡 饮料 外形 不错 京东 包装 严实 摔坏 ,0,1,1
耐心 收到 货 包装 完好无损 砂锅 容量 很大 质量 不错 值得 购买 煲汤 确实 比电 压力锅 煲 汤香 软烂 程度 到位 ,0,1,1
物流 很快 宝贝 挺 可爱 小孩子 喜欢 两天 天气 热 有个 可爱 瓶 水 喝 包装 包 保护膜 幸好 摔坏 完好无损 麻烦 京东 精选 值得 信赖 建议 入手 倒 热水 烫手 ,0,1,1
总体 挺   稍微 丢 丢 瑕疵   影响   便宜   包装 挺 严实   值得 购买 ,1,0,1
碗 不错 简单 大方 釉面 光滑 清洗 值得 购买 ,0,1,1
鞋子 做工 款式 好看 颜色 正 穿着 臭脚 走路 不磨 脚 舒服 ,0,1,1
送货 超级 包装 精美 打开 锅盖 锅体 泡沫板 隔开 特别 精美 锅 图片 介绍 一模一样 区别 惊喜 锅有 分量 厚实 图案 特别 喜人 电梯 时 一位 阿姨 说 这锅 可爱 希望 喜欢 朋友 错过 机会 值得 一分 价钱 一分货 ,1,1,1
收到 迫不及待 开锅 煮 骨头汤 放 白萝卜 香菇 味道 铁锅 电饭煲 煮 好喝 砂锅 质量 不错 往后 多煲 点汤 喝 ,0,0,1
好看 杯子 老公 买 情侣 杯 颜色 质地 清洗 过后 试用 异味 大小 合适 推荐 朋友 做个 参考 ,0,1,1
买来 熬 中药 医生 开 一副 药 放进去 砂锅 容量 合适   熬 壶嘴 倒 滤掉 药渣 ,0,1,0
花型 好看 质量 满意 全 分 好评 ,0,1,1
外观设计 耐看   表面 手感 手感 不错   美观 程度 美观 大气 ,0,1,1
京东 买 两个 砂锅 一段时间 感觉 质量 颜值 在线 煮粥 看着 顶盖 冒出来 炖汤 冒出来 喜欢 ,0,1,1
第二天 送到 点赞   砂锅 样式 好看 蓝色 锅盖 看着 想 做饭 ,0,1,0
厅里 摆件 少 点 摆放 感觉 色彩 鲜艳夺目 ,0,1,0
看起 不错 好看 ,0,1,0
质量 不错 陶瓷 物流 慢 点 ,0,0,1
包装 价格便宜 品质 干净 瑕疵 ,1,0,1
收到 物流 挺快 包装 严实 破损 双 筷子 勺 盘子 碗 质量 特别 特别 喜欢 特别 好看 破损 非常感谢 下次 购买 ,0,1,1
好几家 砂锅 买 爱仕达 打开 包装 特别 打碎 红色 盖子 喜庆 锅子 挺大 一家 四口 熬汤 够用 明 早先 熬点 稀饭 试试 锅子 不错 保温 值得 购买 ,0,1,1
颜值 在线 一款 砂锅 炖汤 煮 海鲜 粥 太 美味 ,0,1,0
表面 手感 手感   实用 效果 宿舍 实用   特色 高端 大气 ,0,1,1
很漂亮 一套 碗盘 后悔 买少 买 一套 可惜 活动 价了 ,1,1,0
包装 精致 手感 外观 不错 认真负责 ,0,1,1
挺 好看 摸 舒服 满意 ,0,1,1
挺 好看 做工 精致 ,0,1,1
质量 不错 样式 很漂亮 价格便宜 ,1,1,1
老婆 刚生 完 宝宝 坐月子 买来 老婆 熬汤 炖菜 大小 刚刚 合适 设计 顺手 小熊 家 东西 一如既往 值得 推荐 一款 砂锅 ,0,1,0
发货 超级 慢 做工 小鹿 塑料 材质 劣质,0,0,-1
家里 老人家 喜欢 炖汤 砂锅 好久 换 买个 6.5 升 大小 炖锅 家里 四个 足够 京东 物流 给力 目前为止 满意 ,0,1,0
想买个 砂锅 煲 品牌 评价 选择 买 优惠活动 价格 优惠 整体 不错 ,1,0,0
买家  瓷盘 厚度 磕 缺口 划到 5.5 价格 划算 ,1,0,-1
棒 购物 价格 赶上 优惠 真省 包装 完美 遇上 大雪 天 小哥 送货上门 属实 感动 产品 美观 实用 价位 知足 一步 尽情 展示 厨艺 ,1,1,1
买 妈妈 砂锅 收到 3.2 升 容量 很大 妈妈 喜欢 说 这下 炖 整只 苏泊尔 牌子 值得 信赖 看着 外观 好看 段时间 再来 追评 京东 物流 昨晚 刚下 收到 喜欢 喜欢 这下 好好 炖汤 ,0,1,0
碗 说 好坏 说 售后服务 值得 说 碗 拿到 碎 找 申请 售后 审核 很快 碗 当天 只能 说 京东 售后 厉害 给力 碗 挺 漂亮 ,0,1,-1
不错 釉质 表面 光滑 隔热 效果 不错 喜欢 好评 ,0,0,1
宝贝 收到 实物 好看 价格 实惠 强烈推荐 款 超级 喜欢 描述 很显 高档 物美价廉 买 朋友 下单 噢 宝贝 收到 质量 不错 包装 精致 材质 优秀 想象 中好 送礼 自用 合适 下次 购买 ,1,1,1
美观 程度 大气 上档次   外观设计 优美 ,0,1,0
黑色 锅身 稳重 大气 档次 宽 开口 放 大块 食物 大小 合适 适合 一家 三口 物流 上午 下单 下午 总体 满意 ,0,1,0
美观 程度 外观 很漂亮 幼稚 白色 好看   外观设计 外观设计 不错 高端 大气 上档次 手柄 设计 适合 人体 工程学   表面 手感 表面 光滑 不错   手工 工艺 做工 考究 白色 烧制 很漂亮   实用 效果 效果 盖子 勺子 喝咖啡 不错 ,0,1,1
包装 瑕疵 厚实 大小 适中 适合 家庭 日常 物流 很快 ,0,1,1
碗 大小 参考 喜欢 碗 装 食物 好看 ,0,1,0
砂锅 很赞 颜值 高 容量 物流 很快 ,0,1,0
颜值 在线 好看 可爱 一款 砂锅 大爱 ,0,1,0
烟灰缸 太漂亮 即能 装 烟灰 摆件 实用 美观 用心 包装 结实 安装 工具 想 周到 物美价廉 一款 商品 点赞 ,1,1,1
鱼盘 不错 好看 包装 细致 破损 ,0,1,1
京东 物流 天下第一 问 武功 唯快 最牛 小哥 配送 给力 碗碟 套装 数量 很足 包装 精美 手感 不错 隔热 效果 还行 字数 难凑 ,0,1,1
很漂亮 大小 合适 煮汤 一家 六口 合适 小熊 品牌 值得 信任 满意 京东 小哥 送上门 服务 超级 ,0,1,0
汤勺 质量 外观 不错 ,0,1,1
美观 程度 流利 外形   外观设计 喜欢 ,0,1,0
货品 包装 质量 杠杠 买 6L 容量 够用 人多时 速度 很快 收货 小哥 服务 ,0,1,1
质量 外观 好看 套装 东西 涵盖 大部分 场景 ,0,1,1
朋友 推荐 超 可爱 斑马 汤锅 系列 砂锅 汤锅 买 一整套 好看 实用 保温 性能 煲 老火 汤 性价比 高,1,1,1
漂亮 干净 无气味 喜欢 京东 力 ,0,1,0
喜欢 特别 好看 实体店 便宜 满意 ,1,1,0
锅 煲 汤 好喝 心 念念 很久 砂锅 买回来 第一天 第一次 小心 煲汤 溢出 满意 送货 不大不小 合适 喜欢 ,0,1,0
挺 态度 责任心 说 真心话 不错 买 东西 第一次 写 东西 性价比 高 谢谢 ,1,0,1
京东 自营 物流 值得 信赖 下单 第二天 收到 货 价格 暖心 超市 价格 优惠 容量 合适 担心 偏大些 收到 货 大小 合适 包装 完好 质感 锅 锅 质地 平滑 工艺 精细 一段时间 发现 推荐 购买 ,1,1,1
杯子 几种 款式 最终 选择 第二天 送货 不错   包装 舒服 外观 设计 美感 白色 杯 身 加一点 金线 勾 简单 简约 简单   杯子 异味 杯壁 光滑 如玉 舒服 多种 场景   其三 说 勺子 造型 美观 搭配 ,0,1,1
宝贝 收到 真心 好用 大火 小火 切换 煮 下午 煲 猪脚 熟 很快 软 糯 质量 质感 强 分量 足 敦实 厚重 好看 感觉 煲汤 利器 悔恨 买晚 早点 下手 省 麻烦 推荐 购买 托 满意 满意 ,0,1,1
杯子 难看 ,0,-1,0
质量 不错 配送 速度 快些 价格 实惠 ,1,0,1
买来 喝 奶茶 咖啡 杯子 不大不小 外观 好看 简单 清洗 值得 推荐 ,0,1,0
大小 合适 砂锅 煮 稀饭 米 煮 很烂 煲汤 煲 汤 锅 性价比 高 ,1,1,1
做工 精致 精美 造型 好看 不错 不错 ,0,1,1
爱仕达 出品 养生 煲 太 喜欢 漂亮 大方 美观 耐用 不贵 包装 破损 速达 送到 家门口 员 辛苦 ,1,1,1
熬 药用 锅 特意 买 想用 嘴 药量 办法 锅 质量 不错,0,0,1
配送 很快   完好无损 喜欢 纯白色 简简单单 大小 适合 价格 不贵 ,1,1,1
超大 容量 煲 整只 外观 精美 内在 清洗 厚实 保温,0,1,1
说用 陶瓷 煲 炖 汤 确实 非常简单 慢熬 规格 适合 炖 刚刚 清洗 不用 洗洁精 洗 干净 超级 实用 厨房用品 值得 推荐 品牌 放心 ,0,1,1
物流 不算 太快 东西 不错 摆上 好看 ,0,1,0
精致 送人 礼品 合适 ,0,0,1
漂亮 碗 颜色 图案 喜欢 质量 不错 ,0,1,1
担心 运 会碎 掉 收到 货 包装 到位 完好无损 样式 简单 干净 大小 适中 表面 光滑 放 水果 炒菜   糕点 挺 ,0,1,1
放 办公室 平时 喝茶 ,0,0,0
一眼 看中 砂锅 砂锅 很漂亮 可爱 京东 物流 送 宝贝 送过来 砂锅 包装 严实 破损 砂锅 质量 不错 摸 光滑 容量 很大 第一次 开锅 煮 一锅 大米 小米 稀饭 煮 排骨 鸡汤 棒 ,0,1,1
好看 不错 京东 品质 上乘,0,1,1
外观 颜值 喜欢 煲汤 熬粥 不错 水分 流失 保温 保证 原汁原味 喜欢 价格 不贵 一家 三口 够用 希望 坏 ,1,1,1
物超所值 话 说 四个 字 正品 信赖 宝贝 质感 价格 适中 无限 回购 从没 想过 实惠 价格 买 宝贝 性价比 高 喜欢 好看 ,1,1,1
美观 程度 好看   外观设计 简单 大方   表面 手感 手感 舒适   实用 效果 盛放 得水   特色 简单 大方 水杯 炒鸡 好看 实惠 强烈推荐 ,1,1,1
场景 地方 好看   美观 程度 美观   大小 尺寸 刚刚   工艺 品质 陶瓷 过得去   老板 客气 说 ,0,1,1
东西 挺好看 下次 关注 ,0,1,0
朋友 装修 买 作 礼物 送人 大气 美观 赞 ,0,1,0
不错 产品 颜色 图片 上白 回老家 拍照 后续 补 评价 ,0,1,0
疫情 一个月 收到 小小的 可爱 很漂亮 ,0,1,0
质感 不错 舒服 好看 ,0,1,1
赶上 618 活动 赶紧 买 两套 陶瓷 釉面 做工 精致 盘子 口径 感觉 盛 凉菜 筷子 勺子 一家人 足够 包装 放在 泡沫 箱里 包装 严实 ,1,1,1
漂亮 上档次 ,0,1,0
盘子 厚实 寸 买 寸 盘子 好多 东西 值得 购买 ,0,0,1
大小 合适 做工 精致 特别 喜欢 满意 京东 员 服务 特别 满意 ,0,1,1
宝贝 收到 好看 亮 马克 派 杯子 做工 精细 釉面 光滑 细腻 轻重 正好 手感 异味 送 勺子 不错 包装 破损 完美 购物 京东 自营 产品 祝 卖家 生意兴隆 递给 力 ,0,1,1
总体 不错 好看 几个 盘子 底边 粗糙 改进 ,0,1,-1
样子 好看 煲汤 耐用 锅 厚实 ,0,1,1
质量 运输 很快 这家 店买 东西 质量 不错 ,0,0,1
价格 划算 包装 物流 很快 ,1,0,0
东西 挺 厚实 服务态度 值得 购买 ,0,0,1
不错 出水 不漏水 整体 导热性 熬药 ,0,0,1
满意 杯子 款式 漂亮 大方 质量 杠杠 滴 味道 杯子 回来 感觉 精致 包装 全是 陶瓷 高端 大气 第二天 买 咖啡 精致 生活 ,0,1,1
